UserID,Status_Accepted,commentBody,ApproveDate,RecommendationCount,Location,DisplayName,UserComments,TimesPeople,CommentSequence,EditorsSelection,ArticleRelevance,ConversationalRelevance,PersonalXP,Readability,Brevity,RecommendationScore,Latitude,Longitude,AVGPersonalXP,AVGReadability,AVGBrevity,AVGRecommendationScore,AVGPicks,AVGcommentspermonth
65260364,approved,George - and if you are in Maryland your schools are better ranked than California,1425571745,2,New York,Andre,api.nytimes.com/svc/community/v2/comments/user/id/65260364.xml,1,14322237,0,3.5985031965131893,9.952664569388448,0.0,6.250000000000002,3.007518796992481,15.561139151014235,40.730599,-73.986581,23.39306704250098,27.8320654494382,15.223666779467678,5.343274927175003,4.479461795520538,53.836621866171
559817,approved,the real reason techies will not locate in Orlando is the humidity.,1425571748,15,Birmingham,john b,api.nytimes.com/svc/community/v2/comments/user/id/559817.xml,1,14322241,0,66.81676334457832,47.472931470453155,0.0,15.217391304347826,2.2556390977443606,60.7956681651614,52.481368,-1.898073,31.187029545539474,31.099827134831457,15.723895874524715,13.165002936078338,12.692307637307692,1.2391573732342007
65152062,approved,"YIKES!! Visit Provo sometime and you will understand why it is the butt of all the jokes about the weirdness of Utah. Happy Valley!! If you aren\'t on some type of pain killer or upper, you just aren\'t fitting in. Everyone in Utah is trying to figure out why anyone would ever want to live there. I\'ve got a great guess. It is within 20 mins of Salt Lake City, and Utah County (where Provo is) cuts taxes so low that companies would be crazy not to build there. To bad that Utah County schools are the worst funded in the nation and that infrastructure is absolutely ignored by the citizens in the area. AS long as you have a mini-mansion it doesn\'t matter that your home is slowly slipping because you built it on sand or a fault and who needs a yard. I want to be able to hear my neighbors in their mini-mansion. Must keep an edge over them after all. I must keep up to the Jones. It is all about getting more than your neighbors. Having a nicer car, bigger home, and better body (see all the ads along I-15...gotta get your plastic surgery fix) is the model in Provo. If you want great outdoors you can go anywhere in Utah. The outdoor industry is up north in an area that is far more welcoming and accommodating. We appreciate diversity and difference. Not like the Mormon Taliban of Utah County, and I am LDS. SAD...Greedy place.   ",1425571784,7,"Ogden, UT",Eric,api.nytimes.com/svc/community/v2/comments/user/id/65152062.xml,1,14322266,0,26.690157080157306,28.848332404925177,23.365384898365384,80.70652173913045,95.48872180451127,43.685640559446846,41.223005,-111.973843,46.397357416521004,84.69101123595505,86.69201520912547,17.223282441762024,0.0,0.29739776951672864
583542,approved,"Not a word about global climate change?  Without planning for the consequences of our destruction of our environment one should not (can not) reasonably discuss where the next anything, never mind the next \""Silicon Valley,\"" will be.  What areas will have potable drinking water? What areas will succomb to rising sea levels?  What about intensified storms?  What about transportation and communications systems? <br/><br/>As throughout history, climate and weather have been drivers of habitation, both human and non-human.  Climate change is here to stay, stay long after all of us are gone; we must make decisions based upon long-term trends and benefits.  The sociopathic greed and avarice  (see \""hoarding disorder\"") that has brought us to the brink, if not over, must not be allowed to drive the choices in where we set up communities.",1425569769,9,"Banks, OR",RichWa,api.nytimes.com/svc/community/v2/comments/user/id/583542.xml,1,14322346,0,18.881654578095343,37.445245758385,29.562043529562043,68.75,48.49624060150376,49.32764400685833,45.618729,-123.114209,44.20096933960453,53.920104578651674,38.94904714828897,28.338688729293583,15.323795284676207,12.658469167286244
57101688,approved,"The law applies throughout California, so discouragement of non-competition clauses cannot be \""the key\"".",1425571788,1,Los Angeles,Gary,api.nytimes.com/svc/community/v2/comments/user/id/57101688.xml,1,14322388,0,0.8810338611832905,17.107132242710435,0.0,15.217391304347826,3.3834586466165413,0.0,34.053717,-118.242727,35.10425463048652,32.82218401685393,18.715072460076044,25.89782945366997,7.829181242170819,3.2644052044609664
59763575,approved,"I agree. Central Florida is a horror: all asphalt (the vast, empty parking lots, the six lane roads) and strip malls, most of them decrepit. There are cars on the beaches. Rarely does a community zone a commercial district to encourage and protect local businesses and restaurants. It\'s all sprawl. There\'s no there there. No one with any interest in having a real life would ever move there voluntarily.",1425569951,13,CO,Contingent,api.nytimes.com/svc/community/v2/comments/user/id/59763575.xml,1,14322408,0,3.936917237355133,19.083940491510546,9.507042234507042,39.94565217391304,24.43609022556391,57.583057327014494,2.893078,-73.784507,51.84402730860546,37.85846050561797,26.133590600760456,14.557935511952786,16.417910283582092,0.8302354401486989
583542,approved,"And how do you propose to live, never mind become the next \""Silicon Valley\"" without drinking water?",1425570368,9,"Banks, OR",RichWa,api.nytimes.com/svc/community/v2/comments/user/id/583542.xml,1,14322508,0,43.63247308516008,77.59178701770661,0.0,11.141304347826086,4.135338345864661,49.32764400685833,45.618729,-123.114209,44.20096933960453,53.920104578651674,38.94904714828897,28.338688729293583,15.323795284676207,12.658469167286244
59183455,approved,Public schools in California are terrible. ,1425571855,3,Bellerose NY,Chris,api.nytimes.com/svc/community/v2/comments/user/id/59183455.xml,1,14322563,0,0.33600032013719777,16.6473891467927,0.0,0.0,0.0,24.663822014654155,40.724269,-73.715131,15.488215405611674,17.1603677247191,6.083650190114068,18.129770991328446,0.0,0.19472473011152416
63859870,approved,"Perfect example of the fortress-like mentality of aspiring 1 per centers. Don\'t want to pay taxes and really don\'t give a darn about the public school system because, hey, I can send my kids to private schools. Hard to imagine true creativity flourishing in such an environment.",1425570608,26,"Los Angeles, CA",kb,api.nytimes.com/svc/community/v2/comments/user/id/63859870.xml,1,14322576,0,3.8350608231240226,13.368516117699155,27.000000027000002,35.32608695652174,16.541353383458645,73.14419647802873,34.053717,-118.242727,38.19977711159896,48.68515418539325,33.03939810646387,22.887228636094243,15.602836684397163,2.3825616765799253
65428171,approved,"Come on, wake up folks. It\'s going to be Silicon Beach: Venice California.",1425572329,1,"Venice, CA",Patrick,api.nytimes.com/svc/community/v2/comments/user/id/65428171.xml,1,14322612,0,20.54318513712598,41.924347370581586,0.0,11.141304347826086,3.007518796992481,0.0,33.995044,-118.466888,39.57748018469491,20.74796210674157,8.529038992395437,14.823753927777267,10.784313639215686,0.9978477791821562
63627949,approved,Boston/Cambridge and San Diego already seem to have a large number of those types of companies.,1425572342,3,NY NY,Jason A.,api.nytimes.com/svc/community/v2/comments/user/id/63627949.xml,1,14322627,0,10.078529604162114,23.183240396213723,0.0,18.75,4.135338345864661,24.663822014654155,43.156168,-75.844995,53.59853938345985,35.73033707865168,20.517110266159694,35.2442748071425,32.999999967,0.9782821368029739
331287,approved,The largest concentration of biotech is also in the Bay Area.  For many of the same reasons as Silicon Valley.,1425572371,13,California,David,api.nytimes.com/svc/community/v2/comments/user/id/331287.xml,1,14322653,0,40.46610024840374,66.94183778623379,0.0,18.75,5.263157894736842,57.583057327014494,36.701463,-118.755997,32.45815215147138,25.242487050561795,11.695081566539923,15.627710030689252,15.813464134186537,53.01115241635687
52856709,approved,"You lost me after using \""data\"" as a singular noun.",1425572374,1,"Rochester, NY",Dave,api.nytimes.com/svc/community/v2/comments/user/id/52856709.xml,1,14322682,0,2.1652382121759586,1.1259818786229023,67.50000006750001,11.141304347826086,1.5037593984962405,0.0,43.185475,-77.610686,51.13020390527429,38.12105379213483,24.822002718631175,13.14652514056413,30.610412769389587,5.7517554728624525
27034584,approved,"Exactly.  Even those of us who live in the former \""Northern California\"", aka \""Silicon Valley\"" are sick of the cartoon and the high tech name dropping.  NoCal is exquisitely gorgeous and is and has been a wonderful place to live long, long, long before the former military industrialist contractors and SRI converted to consumer products.<br/><br/>On this topic, I am in full agreement with Texas governor Rick Perry:  Go To Texas.  They say it is very, very wonderful there.  Go.  Please.  I think you will be happier in some other Silicon Valley.",1425572419,1,Northern Cal,Paul,api.nytimes.com/svc/community/v2/comments/user/id/27034584.xml,1,14322734,0,39.57739515925369,64.73134096480473,21.542553471542554,44.02173913043478,32.33082706766917,0.0,NA,NA,35.47928956557002,59.1316433988764,46.59833961977186,13.606738158476713,28.54671267145329,2.4417032780669143
331287,approved,"I\'ve lived in the Bay Area and worked for tech companies for over 30 yrs.  I\'ve done the research about jobs, investment, VC money, etc.  This is the first article I seen in the NYT that gets it right.  When it comes to technology, there is really no where else that comes close.  If you want to be a first rate banker, go to NY or London.  If you want to be a famous movie star, go to LA.  If you want to do cutting edge technology come here.",1425572427,20,California,David,api.nytimes.com/svc/community/v2/comments/user/id/331287.xml,1,14322848,0,23.474852497543022,36.651732456119944,22.252747297252746,42.119565217391305,31.954887218045112,67.25412445253572,36.701463,-118.755997,32.45815215147138,25.242487050561795,11.695081566539923,15.627710030689252,15.813464134186537,53.01115241635687
55555222,approved,"I hope they did an area ground sounding to preclude the possibility of sinkhole(s).<br/><br/>Sinkholes map of Orange County, Florida , 2008<br/><br/><a href=\""http://fcit.usf.edu/florida/maps/pages/11100/f11148/f11148.htm\"" title=\""http://fcit.usf.edu/florida/maps/pages/11100/f11148/f11148.htm\"" target=\""_blank\"">http://fcit.usf.edu/florida/maps/pages/11100/f11148/f11148.htm</a>",1425572432,3,"Lima, Ohio",augustborn,api.nytimes.com/svc/community/v2/comments/user/id/55555222.xml,1,14322858,0,8.4254967640966,14.240777823365768,10.384615135384616,35.32608695652174,6.390977443609022,24.663822014654155,40.742551,-84.105226,29.380494537108977,51.53048578651685,34.68183851330798,9.886946190941586,10.784313639215686,3.9913911174721184
331287,approved,"You raise good points, but I\'m having trouble seeing the connection to the article.",1425572449,4,California,David,api.nytimes.com/svc/community/v2/comments/user/id/331287.xml,1,14322906,0,0.6956110644376039,5.35901972908,45.00000027,11.141304347826086,3.3834586466165413,31.122278279578495,36.701463,-118.755997,32.45815215147138,25.242487050561795,11.695081566539923,15.627710030689252,15.813464134186537,53.01115241635687
14195106,approved,Just be careful what you wish for. Techies ruined Austin.,1425572452,1,Manhattan,Vin,api.nytimes.com/svc/community/v2/comments/user/id/14195106.xml,1,14322921,0,7.7227968764267425,16.49633551391798,0.0,11.141304347826086,1.5037593984962405,0.0,40.790278,-73.959722,34.98857689661336,44.71819328651684,30.966184273764252,34.21218760968251,31.891635018108367,8.88813788104089
331287,approved,"This is an important point, but just one factor in SV\'s early growth.",1425572469,5,California,David,api.nytimes.com/svc/community/v2/comments/user/id/331287.xml,1,14322953,0,2.9811574273217567,7.985702718988386,0.0,11.141304347826086,3.007518796992481,36.13184615050725,36.701463,-118.755997,32.45815215147138,25.242487050561795,11.695081566539923,15.627710030689252,15.813464134186537,53.01115241635687
331287,approved,"The problem is that people don\'t want what Cleveland produces; they want what SV produces, even if Cleveland has the RnR Hall of Fame.",1425572476,4,California,David,api.nytimes.com/svc/community/v2/comments/user/id/331287.xml,1,14323016,0,2.611416625220424,8.127437567175155,0.0,22.01086956521739,7.142857142857142,31.122278279578495,36.701463,-118.755997,32.45815215147138,25.242487050561795,11.695081566539923,15.627710030689252,15.813464134186537,53.01115241635687
331287,approved,"Non-compete agreements are illegal in CA, not just unenforceable.",1425572479,5,California,David,api.nytimes.com/svc/community/v2/comments/user/id/331287.xml,1,14323031,0,2.039677332715221,11.22224956770326,0.0,11.141304347826086,1.5037593984962405,36.13184615050725,36.701463,-118.755997,32.45815215147138,25.242487050561795,11.695081566539923,15.627710030689252,15.813464134186537,53.01115241635687
38234417,approved,"I\'m a lifer high tech guy with now just shy of 30 yrs in the Front Range (Boulder environs).  I went to a conference once in Orlando, and all I can say is that I had to cross it off my list of tech hub places I might conceive of living...yuck.  Just a huge flat strip mall with jillions of toll roads to get you somewhere, it appeared to me...but I did at least enjoy driving down to Canaveral one day.  The Front Range is very hard to beat, all things considered IMHO.  I would stress here that high tech R&amp;D intensive people really want to actually live where they want to live; drives the hardcore aerospace co HR folks nuts, but it\'s true.  Try to push them somewhere else, and they just quit and start a company.",1425572632,7,Denver,cph,api.nytimes.com/svc/community/v2/comments/user/id/38234417.xml,1,14323090,0,56.99001416908337,45.87888429146285,42.1875000421875,58.423913043478265,51.879699248120296,43.685640559446846,39.739154,-104.984703,57.22461360038153,41.443388061797755,27.782246269961977,48.40997504684675,21.153845878846155,0.9096872951672862
51581368,approved,John:<br/><br/>Thanks for pointing out the obvious. I wondered when someone would mention the elephant in the room. ,1425572656,6,"San Francisco, CA",Joe Aaron,api.nytimes.com/svc/community/v2/comments/user/id/51581368.xml,1,14323110,0,1.3650844466221874,2.5280795606205153,33.750000033750005,11.141304347826086,4.511278195488721,40.22496114321841,37.779277,-122.41927,87.74624394281581,29.258426966292134,18.250950570342205,6.2003816790343285,21.999999978,0.8081461130111524
66015063,approved,Comcast is a technology disaster. They are just the opposite of high tech. Philadelphia is better known for its bio tech companies.,1425572836,3,"Las Vegas,Nevada",NVFisherman,api.nytimes.com/svc/community/v2/comments/user/id/66015063.xml,1,14323119,0,45.48640287362586,42.61513548557915,0.0,18.75,6.015037593984962,24.663822014654155,36.166286,-115.149225,37.56285497529333,31.06239084269663,16.60794130418251,9.944790802579496,9.677419390322582,14.913623442379182
69316274,approved,"As someone who went to public high school in Orlando and then fled north for college, I think that one of the reasons Silicon Valley is in Silicon Valley is that, until the Republicans gutted their property tax, California valued quality, higher education for all. California created the environment conducive for Silicon Valley.<br/><br/>And as someone who just returned from Carmel, California via San Jose,  I can attest to the fact that you can\'t beat vibrant climate of beautiful scenery, incredible food and engaged people looking for solutions for a better world.",1425572888,28,"Westport, CT",LK,api.nytimes.com/svc/community/v2/comments/user/id/69316274.xml,1,14323172,0,68.03256925782401,100.0,14.210526614210528,42.119565217391305,32.70676691729323,74.80791883902533,41.141486,-73.357896,54.49997225433321,55.494051544943815,41.36658463878327,49.323641662252456,16.17647073382353,2.527881040892193
66015063,approved,If your child is gifted why wouldn\'t you send them to a good private school. This applies to any city in the country.  I would rather my child be put in a challenging environment if I can afford it.,1425573607,1,"Las Vegas,Nevada",NVFisherman,api.nytimes.com/svc/community/v2/comments/user/id/66015063.xml,1,14323285,0,3.092091480427573,14.610516053486815,50.625000050625,15.217391304347826,12.781954887218044,0.0,36.166286,-115.149225,37.56285497529333,31.06239084269663,16.60794130418251,9.944790802579496,9.677419390322582,14.913623442379182
17906125,approved,"If you run and bike, none of the other cities in this article has the combination of mild weather and varying terrain that Silicon Valley offers. From my office, I can run the flat trails of the Baylands past the offices of Microsoft, Linkedin, and Google. Close by are the Santa Cruz mountains which challenge you with trail runs, fire roads for mountain bikes, or scenic roads among the redwoods that lead to the coast. The Pacific Ocean is close by for surfing and other water activities. My only beef is the length of the drive to the Sierras for skiing since I was spoiled with a short trip to the ski resorts when I lived in Salt Lake City. Many in the tech sector love this area because it\'s a great outdoor playground that\'s a place to recharge away from the office.",1425573490,16,California,Charles,api.nytimes.com/svc/community/v2/comments/user/id/17906125.xml,1,14323304,0,24.4891385358936,36.78792577812142,23.275862348275865,70.38043478260869,52.25563909774436,62.24455655915699,36.701463,-118.755997,71.50069986700328,30.40730337078651,19.708491760456273,7.856234095638,0.0,0.11739385650557621
2242464,approved,Data is usually considered a singular noun in English despite its origin as the plural form of datum in Latin.,1425575117,3,"San Carlos, CA",GPS,api.nytimes.com/svc/community/v2/comments/user/id/2242464.xml,1,14323373,0,1.9519049061629568,5.430126066619588,0.0,18.75,5.263157894736842,24.663822014654155,37.498206,-122.26615,32.57949861870433,40.6918806741573,27.87208039163498,9.561295892200688,9.82142864017857,2.047656773977695
1941261,approved,"Every few years Johns Hopkins and other local educational, business and political concerns announce with the greatest fanfare a new \""tech\"" initiative for Baltimore.  All these launches share one thing in common - they flop.  Why?  Certainly for several reasons, but it\'s my estimation that tech types have little interest in living here.  Half the city is a ghetto, taxes are huge, crime is high, infrastructure is a disaster, the so-called \""subway\"" goes from nowhere to nowhere, the winter is worse than you\'d ever think, and the summer transforms the city into a fetid swamp.  I am here because I am locked into a job, but I spend as much time as I can out of town.  As a 20-something, I\'d say: no way!",1425575128,14,"Baltimore, MD",Tom,api.nytimes.com/svc/community/v2/comments/user/id/1941261.xml,1,14323411,0,23.19728130641054,26.075416032325098,31.640625031640624,64.40217391304348,45.86466165413533,59.246779710461084,39.290861,-76.610807,26.46378325683099,43.33146067415729,27.163498098859314,65.91984732447023,21.999999978,0.59959227732342
68595930,approved,Orlando has changed since you left 30 years ago.  It\'s become Portlandia in many areas.  I thought tech people were aware of the fact that things change?,1425575132,1,Miami,Feta,api.nytimes.com/svc/community/v2/comments/user/id/68595930.xml,1,14323512,0,76.20345174599588,61.749672465487336,24.107143074107142,15.217391304347826,8.270676691729323,0.0,25.774266,-80.193659,55.54635112588298,16.46067415730337,6.768060836501901,2.9007633586125516,0.0,0.28595939405204457
10919504,approved,"There were a lot of initial reasons SV initially exploded (including a unique mix of Military-Industry Complex funding and counterculture lifestyles) but at this point it\'s basically a \""positive feedback loop\"" (same as with Hollywood and Wall Street) which sort of makes all these articles irrelevant.",1425574628,10,Illyria,Scott,api.nytimes.com/svc/community/v2/comments/user/id/10919504.xml,1,14323558,0,5.288278378193458,13.805930457867293,0.0,33.15217391304348,15.789473684210526,51.69298530152148,42.898593,-91.635152,17.229991613739962,47.77361632022471,33.86243386311787,9.04570055205845,8.730158791269842,1.8015441806691448
6835895,approved,"Indeed, I believe one of the many features of the Silicon Valley is that folks other than American heterosexual Caucasions feel comfortable residing here. Visit any one of the very many strip mall sandwich shops at lunch time and notice the large density and variety of non-Caucasions.",1425574688,9,"San Mateo, Ca",Howard,api.nytimes.com/svc/community/v2/comments/user/id/6835895.xml,1,14323573,0,23.032857956252293,51.8788932910634,14.0624997890625,30.434782608695652,15.789473684210526,49.32764400685833,37.496904,-122.333057,39.304510050087714,28.327571292134827,12.591400996197718,19.94274809046129,0.0,0.3020446096654275
10919504,approved,"A powerful incumbent in an \""old school\"" industry is a drawback, not an advantage.",1425575148,1,Illyria,Scott,api.nytimes.com/svc/community/v2/comments/user/id/10919504.xml,1,14323588,0,5.121267178445286,8.126520730232821,0.0,11.141304347826086,3.007518796992481,0.0,42.898593,-91.635152,17.229991613739962,47.77361632022471,33.86243386311787,9.04570055205845,8.730158791269842,1.8015441806691448
14951172,approved,"In terms of quality of life, Seattle has all that Silicon Valley has and more. Three magnificent national parks lie on its doorstep: Olympic National Park, North Cascades National Park, and Mount Rainier National Park. The San Juans are a ferry ride away. The food, the air, the climate (no, it doesn\'t rain all the time), and the scenery are superb. The roads are less congested than they are in Silicon Valley, and housing is much cheaper. <br/><br/>What Seattle doesn\'t have is Stanford. UW is a respectable school, and it\'s improving, but it\'s not in Stanford or MIT\'s league. If you want to think about the difference a great school can make to a region\'s economy, imagine what Boston, with its ghastly climate and cramped layout, would be like without Harvard and MIT. Conservative politicians increasingly love to attack education in this country, especially public education. We\'ll see who has the last laugh.",1425575171,31,"port angeles, wa",Kaleberg,api.nytimes.com/svc/community/v2/comments/user/id/14951172.xml,1,14323622,0,23.356138075314092,51.89046724991462,4.166667004166667,67.3913043478261,57.89473684210526,77.09293810753637,48.118146,-123.430741,29.75462940552161,36.3463081741573,22.9572437338403,27.435153446902568,8.418367091581633,4.8574969018587355
40373428,approved,"A fundamental difference between the Silicon Valley and these promising areas in other states is the difference between California law and the laws of these others states regarding noncompetition agreements.  California law prohibits noncompetition agreements unless they fall within very narrow exceptions. The two main exceptions are when someone is selling a business or all of their interest in a business (as long as that interest is material and not just a small number of shares, for example). Florida and most other states allow employers to force employees to agree that they won\'t engage in a competing business for up to two years after they leave the employment.  <br/><br/>In the Silicon Valley, as long as an employee is not using the trade secrets of a former employer, the employee can work for a competing company whenever they want. California courts protect this right and scrutinize claims about needing to protect trade secrets of the former employer.  These laws were in effect when the founders of the first \""Silicon Valley\"" companies left their employers and started Intel, etc.  So far, it seems to be working well.<br/><br/>Even if you wanted to live in Orlando, Boise or Provo, if you consider yourself a true innovator and possible serial entrepreneur, unreasonable noncompetition agreements can kill your dreams.",1425574988,15,"San Rafael, California",Tom,api.nytimes.com/svc/community/v2/comments/user/id/40373428.xml,1,14323633,0,46.97431374544824,78.24416882053204,0.0,89.13043478260869,78.57142857142857,60.7956681651614,37.973535,-122.531087,42.59259313209877,55.758426966292134,41.634980988593156,21.755725189594138,0.0,0.040188887732342006
65260364,approved,"That\'s \""Hollywood Dreaming\""...  LA is nowhere near.  Not even close.",1425578022,1,New York,Andre,api.nytimes.com/svc/community/v2/comments/user/id/65260364.xml,1,14323806,0,3.5664372954085946,12.988165700383608,0.0,6.250000000000002,1.8796992481203008,0.0,40.730599,-73.986581,23.39306704250098,27.8320654494382,15.223666779467678,5.343274927175003,4.479461795520538,53.836621866171
23129280,approved,"    Columbus, in Ohio, is very progressive and tolerant, as is Cleveland.  In Columbus, we have a large LGBT community, our city leaders are people of color who run the city very well financially and otherwise.  It\'s a metro area of two million with over 100,000 college students.  We welcome people from everywhere.  Cleveland, Detroit, Chicago, Pittsburgh and other places that aren\'t in New York are the same.  \""Fly over country\"" is not some red monolith filled with uneducated hillbillies, as many on the coasts seem to think.",1425576489,12,Columbus,Roger,api.nytimes.com/svc/community/v2/comments/user/id/23129280.xml,1,14323955,0,13.441850811371411,18.891136391100144,22.4999997975,44.02173913043478,31.57894736842105,55.78610029423265,39.96226,-83.000706,44.25891247320826,53.358917556179776,41.750120494296574,32.161192343578556,11.619718538380281,1.3535411308550185
