userID,status,commentBody,ApproveDate,recommendationCount,location,display_name,userComments,times_people,commentSequence,editorsSelection,ArticleRelevance,ConversationalRelevance,PersonalXP,Readability,Brevity,RecommendationScore,latitude,longitude,AVGPersonalXP,AVGReadability,AVGBrevity,AVGRecommendationScore,AVGPicks,AVGcommentspermonth64671572,approved,"The key factor between silicon valley and these other areas is the legal constraint imposed by non-compete agreements. CA has very, very limited non-compete agreements while the rest of these areas have major. ",1425583493,8,DC,Yoda,api.nytimes.com/svc/community/v2/comments/user/id/64671572.xml,1,14324293,0,0.148347816,0.349783125,0,17.2,35,2.079441542,38.893715,-76.987793,0.014769709,14.79690821,37.54202899,5.192753623,0.008695652,48.1395348864671572,approved,how? improving the tax base? openly mocking conservative values in a conservative state? ,1425583506,4,DC,Yoda,api.nytimes.com/svc/community/v2/comments/user/id/64671572.xml,1,14324303,0,0.005955246,0.014440496,0,12.9,13,1.386294361,38.893715,-76.987793,0.014769709,14.79690821,37.54202899,5.192753623,0.008695652,48.1395348864671572,approved,that greed is also much in abundance in silicon valley. ,1425583551,2,DC,Yoda,api.nytimes.com/svc/community/v2/comments/user/id/64671572.xml,1,14324350,0,0.221736454,0.416638287,0,10.1,10,0.693147181,38.893715,-76.987793,0.014769709,14.79690821,37.54202899,5.192753623,0.008695652,48.1395348817552867,approved,"I don\'t think a conservative state will be as welcoming to tech companies as liberal states are. Conservatives by definition do not like change and change is what the fast moving tech industry is all about. Also, these businesses need a good tax system to attract top talent to its universities and to keep them there. Finally liberal political climates are more attractive to the LGTB community as well as the nation\'s minorities who undoubtedly are an important part of the leadership of these cutting edge tech firms. FL, AL, MS, AR and LA will require way more tax resources to begin to build the necessary educational resources that feed these industries and even then it would take 30 years to see results.",1425578588,15,"Lafayette, LA",D. C. Miller,api.nytimes.com/svc/community/v2/comments/user/id/17552867.xml,1,14324351,0,0.215290446,0.207829396,0.008,28.6,125,2.708050201,30.22409,-92.019843,0.02560236,20.7,79.66666667,8.333333333,0.166666667,0.0740740743298587,approved,"Prominent universities nearby, that provide cutting edge education in technology, check.<br/>A large pool of educated labor, check.<br/>Local investment capital nearby, check.<br/>If there was the political will &amp; organization at a regional level, then Boston (with MIT/Harvard/BU etc...) could be the next big tech hub.  The cost of living and office space may still not be so high as to discourage preliminary \""garage-type\"" startups in an \""experimenting/researching\"" phase.<br/>Many cities and towns with top universities could be the \""Next Tech Hub\"" as well.<br/>Way back when Apple, HP, etc... were forming, Silicon Valley was ideal for startups for small companies in the past because talented people were nearby and because there were \""garage spaces\"" available where overhead costs were (initially) low.  While talented people are still nearby, overhead costs are now an obstacle.  Residential and office rents have been skyrocketing.  It has transformed (or some would say \""matured\"") into a uniformly expensive region affordable by established players and well connected startups that would need to attract lots of cash from the eager VC\'s in the area in order to stay in business long term (i.e.: having enough cash to burn)",1425578887,5,The Internet,TheUnsaid,api.nytimes.com/svc/community/v2/comments/user/id/3298587.xml,1,14324407,0,0.167916605,0.221268533,0.004926108,35.7,197,1.609437912,48.16156,11.574654,0.008654355,30.10748299,141.3979592,9.091836735,0.037414966,2.9696969720516025,approved,"OOPS! This was meant to be my comment on \""Hereâ€™s What Will Truly Change Higher Education: Online Degrees That Are Seen as Official\"".<br/><br/>(I just posted it there.)",1425583674,2,"Kirkwood, Mo",Mark  Feldman,api.nytimes.com/svc/community/v2/comments/user/id/20516025.xml,1,14324475,0,0.005948004,0.024834384,0.066666667,12.9,28,0.693147181,38.5777,-90.418655,0.02993627,35.025,205.435,7.825,0.01,8.69565217433176928,approved,"I lived in Baltimore City from my early 20\'s to early 30\'s, and I loved it. It\'s diverse, it\'s unique, it\'s vibrant, it\'s close to DC &amp; major airports, it has lots of independent restaurants &amp; other small businesses, and the rent is affordable. Yes, it has crime. Yes, there is urban blight &amp; heartbreaking poverty. Yes, the property tax is way too high (discourages people from buying in the city). But, it\'s a real city with real people and real neighborhoods - not everyone wants to live in a sanitized, master planned, expensive town. ",1425583685,6,DC Metro area,Cindy,api.nytimes.com/svc/community/v2/comments/user/id/33176928.xml,1,14324501,0,0.02626425,0.092445596,0.02970297,25.6,101,1.791759469,NA,NA,0.040255163,21.59166667,81.66666667,9.166666667,0.041666667,0.38709677466015063,approved,I really cannot agree with you. Las Vegas has a large LGTB community and is very welcoming to all.  Yet Nevada is a very conservative state with a live and let live attitude. ,1425583716,1,"Las Vegas,Nevada",NVFisherman,api.nytimes.com/svc/community/v2/comments/user/id/66015063.xml,1,14324528,0,0.053266239,0.081456586,0.03030303,14.1,33,0,36.166286,-115.149225,0.024497514,17.05821114,50.67888563,5.485337243,0.017595308,20.058823534030625,approved,"Kansas City. I\'d write more, but then the secret would be out.",1425583720,1,"Kansas City, Mo.",Michael Grimaldi,api.nytimes.com/svc/community/v2/comments/user/id/4030625.xml,1,14324629,0,0.017736215,0.061566384,0.076923077,8.3,13,0,39.084469,-94.56303,0.037694435,18.54583333,64.875,4.458333333,0,0.27272727351675903,approved,"You paint an ideal picture for someone like me who enjoys hiking, biking, and nature. I have been in the programming side of tech since 1995. Most of my professional peers do not share my interest in recreation or being outside at all.  I discovered this reality early in my programming career and it holds true today. Are west coast techies are somehow different?",1425580569,2,Massachusetts,Gerry,api.nytimes.com/svc/community/v2/comments/user/id/51675903.xml,1,14324674,0,0.095250181,0.105686894,0.09375,21.5,64,0.693147181,42.378877,-72.032366,0.033734978,20.9,71.57142857,10.35714286,0,0.27450980453402379,approved,Boston is a beautiful city - intellectual and cultured.  And the climate is no different realistically from NYC and Chicago.  As a result it has a very strong startup environment.,1425583724,0,boston,rjb_boston,api.nytimes.com/svc/community/v2/comments/user/id/53402379.xml,1,14324879,0,0.051956125,0.100599493,0,14.1,29,0,42.360482,-71.059568,0.016838875,17.10897436,50.23076923,5.46474359,0.012820513,3.58620689771516068,approved,"I am surprised that the neither the NYT nor the commentators below bother to cite the extensive work done by organizations like the Kaufmann Foundation detailing the drivers of innovative ecosystems. It might seem obvious to some that being close to a research university is an advantage, but according to Kaufmann\'s analysis, factors like the size and concentration of the metro area, the percentage of college and high school degrees holders, and having deep roots in a or several particular industries is a far better predictor of the level of civic innovation and business formation<br/>. Data going back to the late 1980s shows that the same areas that led industries 2 1/2 decades ago continue to lead them today. Some of that is a refection of success begetting success leading to skills and capital concentrations that self-perpetuate leadership. Outside the US, countries have broken this cycle in a way that US private enterprise has not. South Korea, now a world power in several industries, was in the 1960s still an economic laggard recovering from war. How did they make the change? Vision, will, and the capability of invest in skills development over decades-- a long game. It\'s amusing to see cities throwing up tag lines and tossing a few dollars into an ecosystem believing that they can create the latest Silicon Valley (did you know there is Silicon Andes?) ",1425583740,3,Silicon Somewhere,The Skeptic,api.nytimes.com/svc/community/v2/comments/user/id/71516068.xml,1,14324933,0,0.169654972,0.247106377,0.012820513,38.4,233,1.098612289,NA,NA,0.012931034,38.4,233,3,0,046829521,approved,Unfortunately none of us can afford to live there.,1425583765,0,charlotte,rnahouraii,api.nytimes.com/svc/community/v2/comments/user/id/46829521.xml,1,14324947,0,0.002239382,0.019872918,0.111111111,8.3,9,0,35.227087,-80.843127,0.028985338,12.03807829,24.40213523,3.309608541,0,4.60655737710879693,approved,"I\'m a techie living in Boulder.  My experience has been that far more people leave Silicon Valley to live here than the opposite.  If your company takes off around here, it won\'t be an issue attracting STEM talent to the front range - see the previous sentence.",1425583773,3,Colorado,Chris,api.nytimes.com/svc/community/v2/comments/user/id/10879693.xml,1,14325053,0,0.182035065,0.309512191,0.041666667,17.2,48,1.098612289,38.725178,-105.607717,0.027949727,17.1,57.17647059,10.05882353,0,1.11842105360365678,approved,"Why does location matter in the age of high bandwidth internet?<br/>Can\'t everything that is done in Silicon Valley be done in Mumbai,<br/>Seoul, Tokyo, Shanghai et al?  Can\'t a tech entrepreneur or entrepreneurs<br/>source engineers, designers and marketers anywhere in the world and produce<br/>innovative products?  Perhaps all of this location talk is an illusion.<br/>Perhaps Silicon Valley remains a tech hub because it is cool to live there.",1425583780,2,Las Vegas,Orrin Schwab,api.nytimes.com/svc/community/v2/comments/user/id/60365678.xml,1,14325071,0,0.292783189,0.40258061,0,21.5,70,0.693147181,36.166286,-115.149225,0.017966044,25.64344828,106.1931034,6.689655172,0.04137931,3.29545454548750003,approved,Do you think taxes in California are less?,1425584575,3,"Chevy Chase, MD",Benbo81,api.nytimes.com/svc/community/v2/comments/user/id/48750003.xml,1,14325248,0,0,0.108505194,0,8.3,8,1.098612289,38.993207,-77.074383,0.031862426,13.72093023,37.8372093,6.581395349,0,0.7413793171516588,approved,"While it maintains much of its blue collar sensibility, Pittsburgh is no longer a blue collar town.  Rather it has one of the most highly educated working age populations in the country that includes a vibrant tech scene.  The only tech company that I know of in recent years that went to the Silicon Valley was ModCloth and the only moved their HQ administrative jobs.  Their technology operations are still in Pittsburgh.  Then again, he left Pittsburgh in 2004 and it\'s obvious he has not been back.",1425585428,2,Pittsburgh,JimF,api.nytimes.com/svc/community/v2/comments/user/id/71516588.xml,1,14325493,0,0.220876117,0.295888678,0.011363636,25,88,0.693147181,40.441694,-79.990086,0.011494253,25,88,2,0,015694822,approved,"I would disagree.  Boston summers would be ok, but the winters are ghastly especially this year.",1425588331,3,Ny,Unam,api.nytimes.com/svc/community/v2/comments/user/id/15694822.xml,1,14325624,0,0.002506952,0.0466613,0.0625,12.9,16,1.098612289,43.156168,-75.844995,0.023631498,10.95394737,25.03947368,2.289473684,0,2.37511290709,approved,"Boston and NYC, despite their magnificent universities, are both disadvantaged due to their cold winters and stifling summers, ultimately the effect of the Coriolis force which priviliges the West Coast over the East Coast. Similarly, the West Coast of Europe is warmer than Canada even though both are roughly at the same distance from the equator. Geography is (to a large extent) destiny!",1425587587,3,"Kansas City, MO",cj,api.nytimes.com/svc/community/v2/comments/user/id/11290709.xml,1,14325798,0,0.010325826,0.058148743,0,20.7,63,1.098612289,39.084469,-94.56303,0.000829876,23.38,87.8,7.6,0,0.35714285771516586,approved,"I just moved to Orlando from NJ. (no NJ jokes plz). I own a tech business. I moved to Lake Mary; 60 seconds from the new $21 million Verizon building. Across street from Deloitte and Symantec. I work in downtown Orlando at Canvs in a co-working space for tech startups. I can go on and on about the companies doing business here, the tech infrastructure and the ridiculous ongoing investments in it ... but with this 85 degree weather right now ... I think I\'ll go for a stroll at Lake Eola Park.",1425587889,2,Orlando,NJtoOrlando,api.nytimes.com/svc/community/v2/comments/user/id/71516586.xml,1,14325838,0,0.403994288,0.304675356,0.075268817,22.2,93,0.693147181,28.542118,-81.379046,0.065217391,22.2,93,2,0,066015063,approved,You make statements that are not true. Having lived in Las Vegas for ten years I have found it to it very accepting of every nationality. It has a large Asian and gay community.  ,1425588868,3,"Las Vegas,Nevada",NVFisherman,api.nytimes.com/svc/community/v2/comments/user/id/66015063.xml,1,14325966,0,0.05557164,0.070228813,0.029411765,15.2,34,1.098612289,36.166286,-115.149225,0.024497514,17.05821114,50.67888563,5.485337243,0.017595308,20.0588235346945060,approved,Seattle is more diversified than San Jose/Silicon Valley. That\'s more valuable than the pundits care to point out.<br/>Also there are some of us who don\'t think a place as arid and as brown as the San Francisco Bay region as a great place to live. ,1425591987,3,Seattle,vacciniumovatum,api.nytimes.com/svc/community/v2/comments/user/id/46945060.xml,1,14326026,0,0.210467809,0.285815048,0.02,19.9,49,1.098612289,47.603832,-122.330062,0.044800703,21.28978166,87.63930131,13.48471616,0.03231441,14.8701298712460360,approved,"When I moved from Washington DC to Venice California in the late 1970s, I called my new home \""the land of no shame.\"" I found California to be a place of new ideas, anything on the table, and let\'s do it. With this freedom comes creativity, and therefore a place that I will never leave.",1425591999,6,Los Angeles,Leslie,api.nytimes.com/svc/community/v2/comments/user/id/12460360.xml,1,14326117,0,0.013281078,0.089027088,0.089285714,16.3,56,1.791759469,34.053717,-118.242727,0.058058004,13.69642857,38.14285714,7.178571429,0.035714286,0.32558139563308351,approved,"I read the comment of someone making the case for Cleveland being the next \'tech hub\', and while I acknowledge that weather, the beautiful surroundings (CA has 13 National Parks), the \""progressive\"" political environment (at least on the coast) isn\'t \'everything\'.. I do have to say it\'s a lot.  About my only regret about moving to California is that I didn\'t do it sooner.    It\'s the butt of jokes for people who don\'t live here.. but without it\'s engine (with all due respect to New York and Texas) the Country would be a whole lot poorer.    Where do the venture capitalists live?",1425592022,9,san francisco,acrftr,api.nytimes.com/svc/community/v2/comments/user/id/63308351.xml,1,14326273,0,0.123669891,0.187509214,0.045454545,23.6,108,2.197224577,37.779277,-122.41927,0.032141205,16.49565217,58.17391304,12.30434783,0,161993232,approved,"It\'s been ten years since I started a thriving Internet company in NYC. I still await the day I can work from the beach or hire remote workers. It\'s not coming and truthfully I don\'t want it. <br/><br/>Smart, motivated, creative people need to be surrounded by like minds. These minds tend to aggregate and feed each other. A vibe is born. And it\'s not just the engineers who help create and benefit from this vibe. <br/><br/>When I moved to NYC, it was the grit, determination and pride of an entire city that motivated and pushed me to succeed. The garbage men had more purpose. The panhandlers told more exotic stories. Dancers, writers, shopkeepers, baristas all focused, striving. Relationships with aspiring non-engineers led me to aspiring engineers. And vice-versa.<br/><br/>NYC made me do it.",1425590708,10,"New York, NY",Small Biz,api.nytimes.com/svc/community/v2/comments/user/id/61993232.xml,1,14326299,0,0.010934258,0.056304673,0.055172414,28,139,2.302585093,40.730599,-73.986581,0.059942813,18.87857143,70.64285714,3.5,0.071428571,0.358974359331287,approved,"I lived in Seattle for 6 years before moving to the Bay Area, and particularly enjoyed the great outdoors.  Seattle is a wonderful city, but it is not close to the much larger Bay Area, which has a much better climate, more great educational and research institutions, more first rate cultural institutions, and more of the necessary \""critical mass.\""  The Bay Area\'s Marin County alone has three parks run by the National Park Service: Point Reyes Nat\'l Seashore, Muir Woods and the Golden Gate Nat\'l Recreation Area.  Lake Tahoe and Yosemite are close at hand, as are multiple other National Parks.  If I had to leave the Bay Area, Seattle would be my first choice.  Boston would never get a moments thought.",1425593316,6,California,David,api.nytimes.com/svc/community/v2/comments/user/id/331287.xml,1,14326675,0,0.05657717,0.165003556,0.024,28.6,125,1.791759469,36.701463,-118.755997,0.02116836,14.98632539,37.75806452,8.619915849,0.028751753,71.320193770,approved,"Simply put: No Man (or Woman) is an Island. It\'s not always only about what you do, but also who you do it with. Synergy creates a result much greater than the sum of the parts.",1425593383,5,NYC,Steve,api.nytimes.com/svc/community/v2/comments/user/id/20193770.xml,1,14326812,0,0.009289174,0.009690294,0,15.2,37,1.609437912,40.730599,-73.986581,0.023371468,17.84350282,59.69679849,5.50094162,0.013182674,8.8571517569,approved,"I thought it was interesting to note that the article only briefly mentions Chicago in two separate spots after the second paragraph. It\'s interesting because the second paragraph discusses how the city has been on lists from the Huffington Post and the like in recent years in regard to growing opportunities for tech pros. I also find it interesting that both times Chicago is mentioned in the rest of the article, the city is basically being undersold as much as possible. <br/><br/>I say undersold because the two times Chicago is noted in the text of the article are in regard to how tech pro\'s are at least lukewarm about working in Chicago, compared to them not loving Orlando or Las Vegas. The other mention is at the end of the article where it discusses setting the bar lower to where a city like Chicago at least doesn\'t have to be as worried about losing it\'s start-ups to Silicon Valley like it used to. I find these comments as well as the limited information about Chicago as a tech hub to be rather disparaging to the city compared to other cities that Josh seemed to want to highlight, such as Provo, UT. Which, as Josh mentions, has grown because of newly constructed government tech facilities used by the NSA.  <br/><br/>Is Josh just trying to pump up his political affiliations that have investments in certain cities? He\'s smart enough to know that media helps mold perception and it seems to me that he\'s trying to make good use of his platform to downplay tech opportunities in Chicago. ",1425594727,3,Chicago,David,api.nytimes.com/svc/community/v2/comments/user/id/71517569.xml,1,14327045,0,0.353509507,0.304481615,0.018115942,42.8,272,1.098612289,41.875555,-87.624421,0.014773965,41.6,270,4,0,010464058,approved,"I really like Seattle (lived there nearly 4 years) but having great national parks doesn\'t make it competitive (look at Denver/Boulder)! Sorry but it does rain 10 times more (counted in days) in Seattle than in the Bay Area. People who want to (or have to) live there may get used to it one day but rainy weather nearly 6 months (late Oct. to almost June) is exactly why people say \""it rains there all the time\""!",1425595846,7,USA,Marc,api.nytimes.com/svc/community/v2/comments/user/id/10464058.xml,1,14327121,0,0.048018992,0.134801601,0.012658228,19.9,79,1.945910149,39.78373,-100.445882,0.024568607,15.86644737,46.28947368,3.657894737,0.013157895,1.19685039460654820,approved,"isn\'t Utah County (Provo) currently buoyed by the Federal Government\'s expenditures?<br/><br/>these projects appear to be an oversized governmental-information-military-industrial-complex beyond even President Eisenhower\'s prescient warning...is \""this\"" what our \'new\' silicon-valley ought to be about?",1425595852,2,eugene,sj,api.nytimes.com/svc/community/v2/comments/user/id/60654820.xml,1,14327149,0,0.153505375,0.219873381,0.02173913,19,43,0.693147181,44.050505,-123.095051,0.014869386,24.55873016,104.3730159,3.047619048,0,5.2510464058,approved,"If there ever comes a place that had:<br/>1. Two nationally renowned research universities<br/>2. A strong history of high tech industry<br/>3. Great weather<br/>4. Liberal politics<br/>5. Global cuisine <br/><br/>It would surely be competitive with the Bay Area but alas there isn\'t one like that anywhere I can think of. All these articles about \""The Next Silicon Valley\"" are just feel good stories.",1425595747,12,USA,Marc,api.nytimes.com/svc/community/v2/comments/user/id/10464058.xml,1,14327214,0,0.221750096,0.381956267,0.01369863,19.9,62,2.48490665,39.78373,-100.445882,0.024568607,15.86644737,46.28947368,3.657894737,0.013157895,1.19685039471517569,approved,"Reading this article once more, notice that beyond Josh trying to pump up Provo, he\'s trying to pump up NYC as a tech hub.<br/><br/>This article seems to be nothing more than an NYC citizen being upset that Chicago has outpaced New York in terms of viability in the tech start-up world. Take a look at the particulars that Josh mentions as to why NYC and Provo are competitive destinations for tech pros. There is not one point that Josh makes here about making a city viable, long-term, that Chicago does not have. Josh presents two models that actually make Chicago the best of both Provo and New York as far as what the city can offer to start-ups.<br/><br/>First Model - \'People want to live there and there\'s a really good research university\'. There is an immense amount of cultural and ethnic diversity in Chicago. Lots of people want to live in Chicago. Beyond this, we have a couple of premier universities in the world in Northwestern University and University of Chicago. <br/><br/>Second Model - Cross-Industry Collaboration - Although, not on the level of NYC or LA, Chicago has a plethora of cross-industry collaboration opportunities. Especially, when compared to Provo, UT or any other city in the USA. <br/><br/>Josh also mentions the need for resources. There are plenty of resources available in Chicago to start a high-tech business and with the growth and success we\'ve had, Chicago doesn\'t need to worry about losing our start-ups. It seems to me that Josh is worried about NYC falling into last century.  ",1425595868,5,Chicago,David,api.nytimes.com/svc/community/v2/comments/user/id/71517569.xml,1,14327229,0,0.221723147,0.223191556,0.014440433,40.4,268,1.609437912,41.875555,-87.624421,0.014773965,41.6,270,4,0,068812860,approved,"The government projects in UT are not in the Provo metro area (Utah Valley).  They are located in Salt Lake County, north of Provo.",1425602204,1,"San Jose, CA",Clayton,api.nytimes.com/svc/community/v2/comments/user/id/68812860.xml,1,14327505,0,0.162090495,0.229505985,0,10.1,24,0,37.34385,-121.883135,0,10.1,24,1,0,071494,approved,"Having lived in Silicon Valley much of my adult life, I have some insight on this. First, a location needs a combination of good weather, smart &amp; clever people, lots of venues to interact with one another and places to do start-ups. The valley\'s ecosystem is so abundant, it constantly attracts world wide talent. Beyond being smart, people need to have grit to face repeated failures, imagination to rethink approaches, and the ability to give a receive honest feedback. <br/><br/>In my experience, most other places are too provincial, regardless of size, to support this ecosystem. Still, I worry that the valley is become a smart persons\' country club. There is always a need for the new people to the valley fail in big ways to learn what it takes to thrive here. ",1425598928,4,"Palo Alto, CA",mbergman,api.nytimes.com/svc/community/v2/comments/user/id/71494.xml,1,14327649,0,0.159032595,0.313979614,0.02919708,29.2,133,1.386294361,37.442156,-122.163447,0.034982245,21.52222222,80.88888889,15,0.111111111,0.191489362