userID,status,commentBody,ApproveDate,recommendationCount,location,display_name,userComments,times_people,commentSequence,editorsSelection,ArticleRelevance,ConversationalRelevance,PersonalXP,Readability,Brevity,RecommendationScore,latitude,longitude,AVGPersonalXP,AVGReadability,AVGBrevity,AVGRecommendationScore,AVGPicks,AVGcommentspermonth63984680,approved,"I\'ve been reading \""What\'s the next Silicon Valley?\"" articles since the 1970s, when they used to be \""What\'s the next Silicon Valley / Route 128?\"" articles. All that\'s happened since then is that Route 128 (suburban Boston) lost out badly to Silicon Valley. <br/><br/>The reality is that all the information superhighway hype about how you didn\'t have to live anywhere in particular to do your job turned out backwards. Getting to the top is really about where you live and who you spend time with in person.",1425547472,39,America,Steve Sailer,api.nytimes.com/svc/community/v2/comments/user/id/63984680.xml,1,14319463,0,0.194925033,0,0.010752688,22.9,91,3.663561646,51.447704,5.966069,0.012706799,18.44381737,56.44324667,8.540266328,0.014584654,35.0444444440255154,approved,"Agreed, Steve Sailer. Note, too, that for all the talk of disruption, Silicon Valley\'s status as the epicenter of tech development has grown over decades from historical roots in the military and electronics industries based there at least since the 1950s. You might even say that Silicon Valley evolved \""organically\"" (irony) which helps explain why cities can\'t become \""the new Silicon Valley\"" by waving a few tax breaks and an ad campaign.",1425553927,33,Philadelphia,Doug Hill,api.nytimes.com/svc/community/v2/comments/user/id/40255154.xml,1,14319878,0,0.297980554,0,0,21.5,74,3.496507561,39.952335,-75.163789,0.024959773,21.34639175,79.74226804,10.16494845,0.041237113,1.141176471705268,approved,"There is no next Silicon Valley...it\'s like naming the next Wall Street...driving the 101 between SF and SJ is a fantasy--gleaming office buildings with the names of American companies on them that you\'ve never heard of...but I\'ll give 3 answers..1)The Austin Texas model...big state schools, get an anchor company, and develop from there...2)The \""Me Too\"" Model..New York, which will be an epicenter because a lot of money is here, and people just want to live here, and 3)my favorite, the \""American Bangalore\"", which I favor Rochester--places where really good young talent is produced every year and where the economics make more sense than hiring in India",1425570092,3,"Westfield, NJ",Mike,api.nytimes.com/svc/community/v2/comments/user/id/705268.xml,1,14319995,0,0.116270903,0.253861125,0.033057851,25,121,1.098612289,40.658991,-74.347372,0.015387978,19.58333333,79.52777778,4.611111111,0.027777778,0.61016949211223833,approved,"Salaries in Florida are low, and Orlando salaries are lowest among the major Florida cities.  My son graduated from UCF in Orlando about a decade ago.  The placement office told him that if he wanted to make real money, he would have to leave Florida.  There is a budding start up scene in Orlando and a rapidly growing downtown.  But the reality is that Orlando is a blue collar city that provides an army of low wage workers to support the tourists at the parks and I drive.  If you have a lot of ambition and strong tech skills, there is no reason to stay in Orlando and every reason to go west young man, go west.",1425570103,18,DC,John Smith,api.nytimes.com/svc/community/v2/comments/user/id/11223833.xml,1,14320084,0,0.507652856,0.020759143,0.034188034,23.6,117,2.890371758,38.893715,-76.987793,0.024127529,26.66971609,130.3596215,9.895899054,0.059936909,3.72941176538130104,approved,"Growing up in Florida I could not wait with my technology skills to leave to go....guess where?  San Francisco and in 1986  I never looked back.  I remembered an article a few years later indicted that for every 10 people who moved to Florida over the age 65, 7 people under the age of 30 moved out. <br/><br/>I recently went to Orlando with my spouse who was attending a conference and I was astounded at how Orlando had grown with massive highways and never ending ugly malls and expanding theme parks.  After a few days there visiting one chain place after another, one ugly mall after another, I realized that Orlando had no soul no vibe other than the sounds of never ending traffic.  No individualism or sense of city spirit beyond marketing tourism for Europeans, South Americans or obese Americans who are there for the magic of discounted malls or a theme park a day.  After a lovely day of doing both they head with excitement to visit their favorite chain restaurant serving predictable plastic food that they can get anywhere in the US.   What a vacation and what a place to live.",1425557226,86,SF,SFjoe,api.nytimes.com/svc/community/v2/comments/user/id/38130104.xml,1,14320141,0,0.324817881,0.282171467,0.050761421,30.8,195,4.454347296,37.779277,-122.41927,0.037256761,29.67058824,157.2941176,23.11764706,0,0.3333333337890860,approved,California ha a very big advantage in job mobility for workers because employee non-compete agreements are essentially unenforceable.<br/><br/>Here in Massachusetts I and a number of my friends in high tech have been threatened by our previous employers. Some have had to wait for a year to take a job in a related area after quitting a job.,1425558607,31,"lexington, ma",bentsn,api.nytimes.com/svc/community/v2/comments/user/id/7890860.xml,1,14320265,0,0.125099954,0.028312797,0.06557377,14.1,59,3.433987204,42.447318,-71.2245,0.022836716,16.83405573,45.29721362,19.97213622,0.049535604,4.54929577567432250,approved,I\'m disappointed there is no mention of San Diego. Forbes even named it the top city to bring your start-up for 2014.,1425570107,1,CA,Ryan,api.nytimes.com/svc/community/v2/comments/user/id/67432250.xml,1,14320311,0,0.065004004,0.039537876,0.041666667,12.9,24,0,61.066692,-107.991707,0,12.9,24,1,0,03660662,approved,"In regards to Florida\'s comment about Pittsburgh\'s failure to become a high tech hub, I really do not understand his citing \""lifestyle reasons\"" as one of the reasons. The area has consistently been rated as a great place to live and in the 8 yrs. since my return is only getting better.",1425570112,14,"Pittsburgh, PA",Bill S,api.nytimes.com/svc/community/v2/comments/user/id/3660662.xml,1,14320388,0,0.21308277,0.091258892,0.037037037,19.9,54,2.63905733,40.441694,-79.990086,0.033373467,18.42,53,5.8,0,0.08771929859610530,approved,"Why should anyone desire to be the \""Next Silicon Valley?\"" It\'s reminiscent of all those cities of yore calling themselves \""The Paris of the East\"" instead of capitalizing on their own unique features and identities. <br/><br/>Silicon Valley arose from a unique mix of universities, corporations and venture capital firms, and the fact that all these were in the same geographic area. Instead of trying to mount the impossible task of copying those elements in just the right way, these other cities should be looking at what they already have and finding ways to capitalize on it in ways nobody else can.",1425560167,54,New York,AD,api.nytimes.com/svc/community/v2/comments/user/id/59610530.xml,1,14320420,0,0.182954232,0.234986168,0,29.2,102,3.988984047,40.730599,-73.986581,0.01866507,28.36440678,137.8779661,27.28135593,0.077966102,10.9259259340343536,approved,Does the NSA data center actually employ a lot of people in Utah??<br/><br/>Looking at the photo I see big big buildings but only 2 relatively small parking lots.  Do they let people work from home?,1425570151,10,usa,seeing with open eyes,api.nytimes.com/svc/community/v2/comments/user/id/40343536.xml,1,14320445,0,0.101726067,0.052042537,0.026315789,12.9,36,2.302585093,39.78373,-100.445882,0.026967228,18.25192074,60.57864941,14.40477153,0.012535382,30.530864266015063,approved,A number of high tech companies are investing here in Las Vegas. We have a very good tax structure and excellent infrastructure. Compare a 13% California state income tax with a Nevada zero income tax.  Housing is affordable and of course some the best restaurants/entertainment in the country.  You are talking about a 45 minute plane ride to most of Silicon Valley from Las Vegas.,1425560768,2,"Las Vegas,Nevada",NVFisherman,api.nytimes.com/svc/community/v2/comments/user/id/66015063.xml,1,14320508,0,0.206312373,0.187187845,0.015151515,19,66,0.693147181,36.166286,-115.149225,0.024497514,17.05821114,50.67888563,5.485337243,0.017595308,20.0588235366015063,approved,"Great comment. I have never been to Orlando and based upon your comment I hope that I never have to go that city. I prefer \""sin city\"".",1425570190,2,"Las Vegas,Nevada",NVFisherman,api.nytimes.com/svc/community/v2/comments/user/id/66015063.xml,1,14320531,0,0.367644066,0.348354137,0.148148148,10.1,27,0.693147181,36.166286,-115.149225,0.024497514,17.05821114,50.67888563,5.485337243,0.017595308,20.0588235351581368,approved,"Technology is to the Bay Area what the Renaissance was to Florence. Silicon Valley is attracting America\'s best and brightest.<br/><br/>Strip away the technology and the Bay Area offers the most attractive quality of life in the world given our weather and natural beauty. Combine the three and you dominate for the next 100 years.<br/><br/>That said, there is a major shift within the Bay Area. Silicon Valley is making its way north. San Francisco is the new tech capital of the world.  The kids may work in San Mateo county and San Jose but they want to live in San Francisco. <br/><br/>The appeal of this special area of the world is dwarfs all others. ",1425570217,32,"San Francisco, CA",Joe Aaron,api.nytimes.com/svc/community/v2/comments/user/id/51581368.xml,1,14320759,0,0.272961762,0.263489715,0.008196721,27.5,116,3.465735903,37.779277,-122.41927,0.057225811,16.416,55,3.42,0.04,1.08695652252147740,approved,"\""We have a very good tax structure and excellent infrastructure.\""<br/><br/>And the worst school system in the United States. I\'ll pay 13% and take California.",1425563708,45,"annapolis, md",george eliot,api.nytimes.com/svc/community/v2/comments/user/id/52147740.xml,1,14320966,0,0.006454539,0.078418539,0.071428571,12.9,26,3.80666249,38.97864,-76.492786,0.023381554,15.69105339,44.66378066,25.53823954,0.011544012,1.26647120,approved,Where are the biotechnology hubs going to be?,1425570229,1,Minnesota,Steve S,api.nytimes.com/svc/community/v2/comments/user/id/647120.xml,1,14321172,0,0.081321508,0.028844564,0,8.3,8,0,45.989659,-94.611329,0.02638049,15.12755102,46.06122449,12.48979592,0.020408163,1.5312514442276,approved,"A Stanford law professor has argued persuasively that the key to Silicon Valley success is that California strongly discourages non-competition clauses in employment agreements. The benefit is that employees can move easily to new companies, benefiting the tech environment generally. Most of the other states mentioned allow enforcement of non-competition agreements. Thus, as with Route 28 outside Boston, the early computer industry conglomeration, innovators moved elsewhere. Those who want to emulate California need to think first about changing their state law.",1425564908,33,"Gallatin Gateway, Montana",Dave Anderson,api.nytimes.com/svc/community/v2/comments/user/id/14442276.xml,1,14321221,0,0.16491385,0.222189592,0,28.6,83,3.496507561,45.591596,-111.19773,0.015931027,17.3625,50.125,17.5,0,0.12698412764878340,approved,"Even Montreal is trying to be Silicon Valley, despite some advice to the contrary.<br/><a href=\""http://montrealgazette.com/business/apple-co-founder-steve-wozniak-to-montreal-dont-try-to-be-silicon-valley\"" title=\""http://montrealgazette.com/business/apple-co-founder-steve-wozniak-to-montreal-dont-try-to-be-silicon-valley\"" target=\""_blank\"">http://montrealgazette.com/business/apple-co-founder-steve-wozniak-to-mo...</a>?",1425570247,0,Linden,Ichigo Makoto,api.nytimes.com/svc/community/v2/comments/user/id/64878340.xml,1,14321262,0,0.176527834,0.325304096,0,19.9,15,0,33.009572,-94.36675,0.028843563,12.88677249,28.2010582,5.481481481,0.015873016,4.566015063,approved,If that is true why isn\'t New Jersey\'s tech environment growing? The courts of New Jersey pretty much disregard non-competition agreements.,1425570293,1,"Las Vegas,Nevada",NVFisherman,api.nytimes.com/svc/community/v2/comments/user/id/66015063.xml,1,14321483,0,0.103552719,0.088505937,0,12.9,24,0,36.166286,-115.149225,0.024497514,17.05821114,50.67888563,5.485337243,0.017595308,20.0588235366015063,approved,Actually most parents in the tech sector in Las Vegas send their children to private schools;these are comparable in quality to private schools anywhere in the USA. The tax savings easily pay for private school education expenses.,1425566228,4,"Las Vegas,Nevada",NVFisherman,api.nytimes.com/svc/community/v2/comments/user/id/66015063.xml,1,14321535,0,0.145273667,0.123879115,0.026315789,17.2,38,1.386294361,36.166286,-115.149225,0.024497514,17.05821114,50.67888563,5.485337243,0.017595308,20.0588235369126622,approved,"1000+Computer programmer &amp; database administrator jobs in Austin. The job demand for those are so great, Austin tech/govt employers had to partner with Austin Community College to create an accelerated certificate/degree program.",1425570296,4,"Austin, TX",Brian C.,api.nytimes.com/svc/community/v2/comments/user/id/69126622.xml,1,14321566,0,0.067892881,0.073193787,0.028571429,16.3,35,1.386294361,30.271129,-97.7437,0.02324983,14.38823529,34.82352941,13.64705882,0,1.742827947,approved,What about the kids that have to go to the public schools?,1425570329,6,Somewhere In IL,Not A Victim,api.nytimes.com/svc/community/v2/comments/user/id/42827947.xml,1,14321596,0,0.004433509,0.025670702,0,8.3,12,1.791759469,NA,NA,0.044191372,14.79329897,41.06357388,10.68041237,0.013745704,9.763752771,approved,"California has the environmental and business climate that smart people like.  I think other cities need to look at their strengths and weakness to become their own success.  I would never consider living in Florida year round, and while Seattle has its share of rain, it is a city with a great personality, so I would consider living there.  Give your city an appealing personality. Make it real.",1425566589,9,"Sacramento, Calif.",JoeB,api.nytimes.com/svc/community/v2/comments/user/id/63752771.xml,1,14321618,0,0.048759703,0.113604523,0.044117647,22.9,68,2.197224577,38.581572,-121.4944,0.031940163,21.61172023,84.85255198,17.18777568,0.078764965,35.2666666765260364,approved,I understand totally.  I have relatives who relocated to central Florida to escape the winter.  Many times they tried to recruit me to move.   After a week or so I\'m ready to leave.  I tried to see myself living there but I just can\'t see it.  Soul-less indeed.,1425571586,7,New York,Andre,api.nytimes.com/svc/community/v2/comments/user/id/65260364.xml,1,14321634,0,0.027327387,0.070179634,0.137254902,15.2,51,1.945910149,40.730599,-73.986581,0.015256348,15.9082153,47.03824363,2.94723796,0.008144476,72.4102564139924852,approved,"You\'re absolutely right. It\'s very difficult, if virtually impossible to overcome (or even rival) the advantages of an incumbent. Hollywood is still the center of the entertainment industry and New York City is still the center of finance. And both evolved into those positions through a very \""organic\"" process. The other cities mentioned are (or have been) the center of very different industries; Orlando and tourism and Pittsburgh and industrial production.",1425566648,11,New York City,Fred,api.nytimes.com/svc/community/v2/comments/user/id/39924852.xml,1,14321639,0,0.272952361,0.198334393,0,20.7,73,2.397895273,40.730599,-73.986581,0.019638726,17.40915033,55.15250545,9.773420479,0.019607843,6.37565260364,approved,Very true... Though Route was very successful it\'s own right... Just like in the Bay Area with San Fran seeing faster growth - Boston/Cambridge is where the growth is in that area.,1425571627,0,New York,Andre,api.nytimes.com/svc/community/v2/comments/user/id/65260364.xml,1,14321667,0,0.062966674,0.132614321,0,16.3,33,0,40.730599,-73.986581,0.015256348,15.9082153,47.03824363,2.94723796,0.008144476,72.4102564114442276,approved,You hit the nail on the head.,1425571642,2,"Gallatin Gateway, Montana",Dave Anderson,api.nytimes.com/svc/community/v2/comments/user/id/14442276.xml,1,14321687,0,0,0.005547063,0,6,7,0.693147181,45.591596,-111.19773,0.015931027,17.3625,50.125,17.5,0,0.12698412720413827,approved,"Mr. Florida seems to take any opportunity to slight Pittsburgh. The city ranks 24th out of 100 metro areas in number of advanced industry jobs, according to the Brookings report cited in the article. Not great, but not bad. Allowing personal prejudice to cloud professional judgment may land Mr. Florida in his own cautionary tale.",1425571648,1,NY,Ginzberg,api.nytimes.com/svc/community/v2/comments/user/id/20413827.xml,1,14321689,0,0.108507655,0.125647529,0,18.2,55,0,43.156168,-75.844995,0.030473702,17.83333333,57.46666667,9.653333333,0.053333333,0.8928571438543514,approved,"NVFisherman espouses the idea that \""it\'s fine that most of my kid\'s friends go to crummy [public] schools, as long as my kid goes to a good [private] school\"".  As a father, I recommend against this thinking.  Your kid\'s friends will influence him/her in a very negative way.",1425571655,10,"Wakeman, Ohio",Dan Styer,api.nytimes.com/svc/community/v2/comments/user/id/8543514.xml,1,14321696,0,0.002844756,0.024258427,0.115384615,18.2,52,2.302585093,41.254587,-82.399659,0.022216044,19.33170189,61.65517241,11.37263626,0.0189099,10.4534883764733832,approved,"I\'d keep an eye on Philadelphia. Not only is there a hugely active independent tech scene (whose epicenter is roughly N. 3rd Street, or as they actually officially ordained it last year, \""N3RD St.\""), but Comcast is doubling down on the   city with a brand new tower under construction that will employ 2,000 tech workers. Regardless of what you think of the company, it\'s growing like crazy and Center City Philadelphia is filled with young workers in this and other technology companies.",1425571662,0,"Collingswood, NJ",Joseph,api.nytimes.com/svc/community/v2/comments/user/id/64733832.xml,1,14321719,0,0.15213021,0.156931922,0.011764706,21.5,85,0,39.918169,-75.071284,0.040847081,17.45,66.78571429,11.78571429,0.071428571,0.37837837845782424,approved,"There always will be Megatrends about how and where technology evolves. Few want to remember Menlo Park in Edison,NJ where in a barn like structure,Thomas Edison worked on his illumination device with a tungsten filament perfected later by Louis Latimer,an African American,son of a former slave. Anyway,Florida has a lot of areas beyond Orlando where technology is growing and a secretive bunch near Ft.Lauderdale is developing Leap Magic. In Odessa,a nanotechnology firm Dais Analytics is working on water membranes,battery storage and better air handling systems that China loves. In Tarpon Springs,Magnegas is making progress on welding gas from waste material. So,with the economy rebounding and our infamous Governor Scott touting Jobs all the time,deal makers are taking a close look beyond the malls and palm trees and beaches and golf courses down here for good,future profitable reasons. Including Fortress Group,helping to build the Miami-Orlando railroad line. As Jim Dooley used to pitch for Tropicana juice,\""Come on down....\""",1425571687,1,Palm Harbor,mark,api.nytimes.com/svc/community/v2/comments/user/id/45782424.xml,1,14321903,0,0.214924805,0.195034727,0.011627907,37.1,172,0,28.078072,-82.763713,0.021099841,28.51212121,135.6818182,4.742424242,0.03030303,1.40425531955516297,approved,"Silicon Valley is a product of several factors: close nit relationship with the very very best universities in the World and National Labs, progressive laws and politics, open and collaborative professional culture, a long legacy in high tech, and fame around the World.<br/><br/>I frankly do not think it can be \""reproduced\"" anywhere else in the US. At best, we will have pockets of \""mini SV\"" in the East Coast (Mass, NY) and a few central states.",1425568809,7,"Palo Alto, CA",R. Teixeira,api.nytimes.com/svc/community/v2/comments/user/id/55516297.xml,1,14322107,0,0.168906585,0.201256779,0.037974684,21.5,77,1.945910149,37.442156,-122.163447,0.018510676,14.34210526,33.05263158,55.15789474,0.052631579,0.82608695770264887,approved,At which point you have no advantage.,1425571706,1,"Santa Fe, NM",kaneable,api.nytimes.com/svc/community/v2/comments/user/id/70264887.xml,1,14322142,0,0.020706076,0.029928391,0,6,7,0,35.649296,-105.922455,0,6,7,1,0,04569526,approved,"If we\'ve learned anything from Silicon Valley, it\'s that Technologists, and related companies, are not going to locate in areas where the political, environmental, and social atmosphere is not progressive and tolerant.  Las Vegas and Florida and Ohio do not present tolerant, progressive communities. Rather they have governments that cling to 19th century viewpoints that are simply not tolerable by today\'s technology elite. Like it or not, today\'s technologists are almost universally aligned with blue-state values.<br/><br/>Want to attract technology companies? Create communities where quality of life and progressive politics thrive.  That\'s why you see Boulder, Austin, San Francisco, New York, Seattle, and a few other areas reaping the benefits.",1425571732,58,New York City,David Tussey,api.nytimes.com/svc/community/v2/comments/user/id/4569526.xml,1,14322158,0,0.165331505,0.254064865,0.008474576,32.4,116,4.060443011,40.730599,-73.986581,0.030424023,20.09171598,69.31952663,16.87573964,0.124260355,1.22463768148054569,approved,"Provo is an interesting example.  In the end the advantage of \""people wanting to be there\"" may be self-limiting.  If you\'re a Mormon IT person, all is well.  But Provo and Utah County are overwhelmingly LDS, notoriously insular and socially regressive.  Horror stories abound of non-Mormons leaving after their kids are ostracized in school.  I\'d add that tolerance of diversity is also a prerequisite.  All the other tech incubatoriums have it in large measure, Provo does not. ",1425571742,32,South Korea,MHR,api.nytimes.com/svc/community/v2/comments/user/id/48054569.xml,1,14322225,0,0.127732413,0.076383118,0.012345679,23.6,81,3.465735903,35.398501,127.937111,0.02791734,17.02916667,64.79166667,14,0.041666667,0.30379746865260364,approved,George - and if you are in Maryland your schools are better ranked than California,1425571745,2,New York,Andre,api.nytimes.com/svc/community/v2/comments/user/id/65260364.xml,1,14322237,0,0.018826494,0.047177724,0,8.3,14,0.693147181,40.730599,-73.986581,0.015256348,15.9082153,47.03824363,2.94723796,0.008144476,72.41025641559817,approved,the real reason techies will not locate in Orlando is the humidity.,1425571748,15,Birmingham,john b,api.nytimes.com/svc/community/v2/comments/user/id/559817.xml,1,14322241,0,0.349569064,0.225031683,0,11.6,12,2.708050201,52.481368,-1.898073,0.020339367,17.07153846,48.35384615,7.261538462,0.023076923,1.66666666765152062,approved,"YIKES!! Visit Provo sometime and you will understand why it is the butt of all the jokes about the weirdness of Utah. Happy Valley!! If you aren\'t on some type of pain killer or upper, you just aren\'t fitting in. Everyone in Utah is trying to figure out why anyone would ever want to live there. I\'ve got a great guess. It is within 20 mins of Salt Lake City, and Utah County (where Provo is) cuts taxes so low that companies would be crazy not to build there. To bad that Utah County schools are the worst funded in the nation and that infrastructure is absolutely ignored by the citizens in the area. AS long as you have a mini-mansion it doesn\'t matter that your home is slowly slipping because you built it on sand or a fault and who needs a yard. I want to be able to hear my neighbors in their mini-mansion. Must keep an edge over them after all. I must keep up to the Jones. It is all about getting more than your neighbors. Having a nicer car, bigger home, and better body (see all the ads along I-15...gotta get your plastic surgery fix) is the model in Provo. If you want great outdoors you can go anywhere in Utah. The outdoor industry is up north in an area that is far more welcoming and accommodating. We appreciate diversity and difference. Not like the Mormon Taliban of Utah County, and I am LDS. SAD...Greedy place.   ",1425571784,7,"Ogden, UT",Eric,api.nytimes.com/svc/community/v2/comments/user/id/65152062.xml,1,14322266,0,0.139636414,0.136747165,0.034615385,35.7,260,1.945910149,41.223005,-111.973843,0.030259146,36.15,235,9.5,0,0.4583542,approved,"Not a word about global climate change?  Without planning for the consequences of our destruction of our environment one should not (can not) reasonably discuss where the next anything, never mind the next \""Silicon Valley,\"" will be.  What areas will have potable drinking water? What areas will succomb to rising sea levels?  What about intensified storms?  What about transportation and communications systems? <br/><br/>As throughout history, climate and weather have been drivers of habitation, both human and non-human.  Climate change is here to stay, stay long after all of us are gone; we must make decisions based upon long-term trends and benefits.  The sociopathic greed and avarice  (see \""hoarding disorder\"") that has brought us to the brink, if not over, must not be allowed to drive the choices in where we set up communities.",1425569769,9,"Banks, OR",RichWa,api.nytimes.com/svc/community/v2/comments/user/id/583542.xml,1,14322346,0,0.098784227,0.177498343,0.04379562,31.3,135,2.197224577,45.618729,-123.114209,0.028826719,25.19555723,109.435994,15.6310241,0.027861446,17.02564103