UserID,Status_Accepted,commentBody,ApproveDate,RecommendationCount,Location,DisplayName,UserComments,TimesPeople,CommentSequence,EditorsSelection,ArticleRelevance,ConversationalRelevance,PersonalXP,Readability,Brevity,RecommendationScore,Latitude,Longitude,AVGPersonalXP,AVGReadability,AVGBrevity,AVGRecommendationScore,AVGPicks,AVGcommentspermonth
51419510,approved,"Data can also be used as a collective noun, since  statistical discussion with N=1, a datum, are pointless.  If you are discussion a geographical location, a datum is fine.",1425578140,3,Madison VA,Bill R,api.nytimes.com/svc/community/v2/comments/user/id/51419510.xml,1,14323971,0,6.5628324337362365,9.015435283242775,0.0,22.01086956521739,9.022556390977442,24.663822014654155,38.380406,-78.257504,36.753765571517576,36.61602525280899,20.378400794676804,8.227095708403029,18.299445431700555,6.284851301115241
18398873,approved,"Austin is the most likely candidate due to educational infrastructure, relatively low cost of living and quality of life (except for the opressive heat and opressive politics of course).",1425577029,4,Colorado,Cedar,api.nytimes.com/svc/community/v2/comments/user/id/18398873.xml,1,14324055,0,1.3250548727711149,19.879245697362393,0.0,18.75,8.646616541353383,31.122278279578495,38.725178,-105.607717,38.66699144711263,53.68705783707864,41.95089893536121,45.06479124551155,32.59259241740741,4.7049256505576205
24878,approved,"Still, Silicon Valley resident tech workers have faced -- and no doubt still do -- attempts to limit their mobility.  See this recent settlement on so-called \""non-poaching\"" agreements that tech owners set up and ran as long as they possibly could ...<br/><br/><a href=\""http://finance.yahoo.com/news/judge-oks-415m-settlement-tech-190945259.html\"" title=\""http://finance.yahoo.com/news/judge-oks-415m-settlement-tech-190945259.html\"" target=\""_blank\"">http://finance.yahoo.com/news/judge-oks-415m-settlement-tech-190945259.html</a>",1425578145,2,"San Francisco, CA",Berkeley Bee,api.nytimes.com/svc/community/v2/comments/user/id/24878.xml,1,14324091,0,57.60411571262374,79.1392048317923,0.0,39.94565217391304,13.533834586466165,15.561139151014235,37.779277,-122.41927,46.029872614806074,40.460435365168536,29.15039851711026,11.630227810975368,7.38255044261745,14.449652498141262
25345298,approved,"Boulder is a nice place, but so space constrained that if your business takes off, you will be hard pressed to stay in that location.   And if you move, why a hop to, say Denver, but why not into the highly attractive brain vortex of Silicon Valley? <br/><br/>The biggest problem many sites have is simply no ability to scale.  Your rapidly growing business can attract 100 more top tier workers in Silicon Valley and maybe somewhere like NY, but Orlando?  Really?  Since no one starts a business with the intent to fail, the net result of the lack of a deep workforce is a real drawback on top of all the other drawbacks pointed out in the article. ",1425578044,6,NY,MH,api.nytimes.com/svc/community/v2/comments/user/id/25345298.xml,1,14324113,0,58.06529463146388,75.71556966272124,0.0,51.630434782608695,42.10526315789473,40.22496114321841,43.156168,-75.844995,13.42711486265987,59.004872949438194,43.79028851711026,10.273536895690446,11.827956788172044,3.142953700371747
54281250,approved,What he means is that the tech people want to be around other rich tech people and don\'t want to be around blue collar Pittsburgh folks.<br/><br/>Let \'em leave to their godawful expensive region that will only get more expensive as the water continues to dry up.  Long live the \'burgh.,1425578051,4,Houston,J,api.nytimes.com/svc/community/v2/comments/user/id/54281250.xml,1,14324116,0,38.95518142689244,39.03917184570367,0.0,22.01086956521739,17.293233082706767,31.122278279578495,29.981501,-95.53836,29.246613069817528,31.374002752808984,20.08989780608365,15.703481936410105,14.312267735687731,2.94117647063197
20516025,approved,"From my perspective, as a form math professor, this excellent article misses only one important point about the conflict between traditional colleges and online courses  a point that my experience teaching from an online MIT course at Washington U. in St. Louis, makes clear.  <br/><br/>Many traditional colleges, seeing students as customers, teach only what those customers think they need to know, not what they need to know. <br/><br/>Online courses can expose this strategy.<br/><br/>For example, when I taught a math course that is a critical requirement for engineers, I utilized the available MIT online materials.  Those materials were excellent, but challenging.  My chair and the administrators from the Engineering school were upset. <br/><br/>My Chair told me that he wasnt going to let the Engineering School take away (the apparently highly lucrative) course and he demanded that I teach the normal cookbook course so that he wouldn\'t have \""trouble\"".<br/><br/>When I wrote the Dean of Eng. Student Academic Integrity that the students who cheated on the homework were the ones who did poorly on the test, he replied that I shouldnt discourage students and that retention was critical.<br/><br/>On the web, one can access both the course I taught (or just the MIT course) and the cookbook course that Wash. U., and many other schools, teach. If people do that, I believe that two things will happen: the value of online courses will be apparent; and, some so-called elite schools will have to clean up their act.",1425578089,0,"Kirkwood, Mo",Mark  Feldman,api.nytimes.com/svc/community/v2/comments/user/id/20516025.xml,1,14324202,0,1.9078738084796185,8.3169897022229,31.034482456034482,85.59782608695653,91.35338345864662,0.0,38.5777,-90.418655,45.90228088087731,81.53089887640448,75.45057034220532,14.18654580071451,5.4999999945,6.46516890260223
64671572,approved,"a lot of the politics are killers (i.e., anti-abortion, anti-homosexual, etc.). ",1425583453,5,DC,Yoda,api.nytimes.com/svc/community/v2/comments/user/id/64671572.xml,1,14324256,0,1.4501921851522106,3.079607401139003,48.21428547321428,15.217391304347826,3.007518796992481,36.13184615050725,38.893715,-76.987793,22.64688723901881,24.710416320224716,11.61293877946768,9.414343399938108,4.782608595217392,35.79147574721189
66707515,approved,"Orlando? The extremely humid, dull city in central Florida not near any beaches? That city is the last place any up-and-coming tech company would want to be. I\'ll stick with NY or CA, which are both conveniently located far away from the South.",1425583460,20,a,nothingreally,api.nytimes.com/svc/community/v2/comments/user/id/66707515.xml,1,14324262,0,59.57342987563726,60.61262968540939,14.673912764673913,15.217391304347826,15.037593984962406,67.25412445253572,40.769627,44.673665,43.265847601907296,45.365168539325836,32.382762992395435,38.676844775457425,91.66666675833333,0.15382643271375465
65260364,approved,Plenty of places HSR natural beauty (even Idaho is beautiful) and many people like seasons...  The Bay Areas success had to do with the universities and te defense contractors and the cheap land in that area of the Valley. Like other places - once the industry starts rolling - it just keeps going.,1425583485,0,New York,Andre,api.nytimes.com/svc/community/v2/comments/user/id/65260364.xml,1,14324275,0,15.417963837662397,34.3642143698183,0.0,33.15217391304348,16.917293233082706,0.0,40.730599,-73.986581,23.39306704250098,27.8320654494382,15.223666779467678,5.343274927175003,4.479461795520538,53.836621866171
64671572,approved,"very well put. If anything, non-compete agreements had prevented Boston from being the next silicon valley. The most important factor by far. ",1425583489,3,DC,Yoda,api.nytimes.com/svc/community/v2/comments/user/id/64671572.xml,1,14324276,0,37.932643667244385,87.31008646221714,0.0,18.75,6.390977443609022,24.663822014654155,38.893715,-76.987793,22.64688723901881,24.710416320224716,11.61293877946768,9.414343399938108,4.782608595217392,35.79147574721189
64671572,approved,"The key factor between silicon valley and these other areas is the legal constraint imposed by non-compete agreements. CA has very, very limited non-compete agreements while the rest of these areas have major. ",1425583493,8,DC,Yoda,api.nytimes.com/svc/community/v2/comments/user/id/64671572.xml,1,14324293,0,28.355257759185033,73.79063295120957,0.0,30.434782608695652,10.902255639097744,46.68341743059273,38.893715,-76.987793,22.64688723901881,24.710416320224716,11.61293877946768,9.414343399938108,4.782608595217392,35.79147574721189
64671572,approved,how? improving the tax base? openly mocking conservative values in a conservative state? ,1425583506,4,DC,Yoda,api.nytimes.com/svc/community/v2/comments/user/id/64671572.xml,1,14324303,0,1.1382879768810052,3.0463829264759705,0.0,18.75,2.631578947368421,31.122278279578495,38.893715,-76.987793,22.64688723901881,24.710416320224716,11.61293877946768,9.414343399938108,4.782608595217392,35.79147574721189
64671572,approved,that greed is also much in abundance in silicon valley. ,1425583551,2,DC,Yoda,api.nytimes.com/svc/community/v2/comments/user/id/64671572.xml,1,14324350,0,42.38278983343897,87.89447149412285,0.0,11.141304347826086,1.5037593984962405,15.561139151014235,38.893715,-76.987793,22.64688723901881,24.710416320224716,11.61293877946768,9.414343399938108,4.782608595217392,35.79147574721189
17552867,approved,"I don\'t think a conservative state will be as welcoming to tech companies as liberal states are. Conservatives by definition do not like change and change is what the fast moving tech industry is all about. Also, these businesses need a good tax system to attract top talent to its universities and to keep them there. Finally liberal political climates are more attractive to the LGTB community as well as the nation\'s minorities who undoubtedly are an important part of the leadership of these cutting edge tech firms. FL, AL, MS, AR and LA will require way more tax resources to begin to build the necessary educational resources that feed these industries and even then it would take 30 years to see results.",1425578588,15,"Lafayette, LA",D. C. Miller,api.nytimes.com/svc/community/v2/comments/user/id/17552867.xml,1,14324351,0,41.150697421928385,43.84391807554348,5.4000000054,61.413043478260875,44.73684210526316,60.7956681651614,30.22409,-92.019843,39.25695218319911,41.29213483146067,27.62991128136882,15.108142492169382,91.66666675833333,0.05507366096654275
3298587,approved,"Prominent universities nearby, that provide cutting edge education in technology, check.<br/>A large pool of educated labor, check.<br/>Local investment capital nearby, check.<br/>If there was the political will &amp; organization at a regional level, then Boston (with MIT/Harvard/BU etc...) could be the next big tech hub.  The cost of living and office space may still not be so high as to discourage preliminary \""garage-type\"" startups in an \""experimenting/researching\"" phase.<br/>Many cities and towns with top universities could be the \""Next Tech Hub\"" as well.<br/>Way back when Apple, HP, etc... were forming, Silicon Valley was ideal for startups for small companies in the past because talented people were nearby and because there were \""garage spaces\"" available where overhead costs were (initially) low.  While talented people are still nearby, overhead costs are now an obstacle.  Residential and office rents have been skyrocketing.  It has transformed (or some would say \""matured\"") into a uniformly expensive region affordable by established players and well connected startups that would need to attract lots of cash from the eager VC\'s in the area in order to stay in business long term (i.e.: having enough cash to burn)",1425578887,5,The Internet,TheUnsaid,api.nytimes.com/svc/community/v2/comments/user/id/3298587.xml,1,14324407,0,32.095643503253584,46.67905320548441,3.325122903325123,80.70652173913045,71.80451127819549,36.13184615050725,48.16156,11.574654,13.27001106192672,67.71764884831461,51.101885627376426,16.483291789609734,20.578231279421768,2.2079531375464683
20516025,approved,"OOPS! This was meant to be my comment on \""Heres What Will Truly Change Higher Education: Online Degrees That Are Seen as Official\"".<br/><br/>(I just posted it there.)",1425583674,2,"Kirkwood, Mo",Mark  Feldman,api.nytimes.com/svc/community/v2/comments/user/id/20516025.xml,1,14324475,0,1.1369037382570135,5.239088976386131,45.00000027,18.75,8.270676691729323,15.561139151014235,38.5777,-90.418655,45.90228088087731,81.53089887640448,75.45057034220532,14.18654580071451,5.4999999945,6.46516890260223
33176928,approved,"I lived in Baltimore City from my early 20\'s to early 30\'s, and I loved it. It\'s diverse, it\'s unique, it\'s vibrant, it\'s close to DC &amp; major airports, it has lots of independent restaurants &amp; other small businesses, and the rent is affordable. Yes, it has crime. Yes, there is urban blight &amp; heartbreaking poverty. Yes, the property tax is way too high (discourages people from buying in the city). But, it\'s a real city with real people and real neighborhoods - not everyone wants to live in a sanitized, master planned, expensive town. ",1425583685,6,DC Metro area,Cindy,api.nytimes.com/svc/community/v2/comments/user/id/33176928.xml,1,14324501,0,5.020158696516809,19.50242465925653,20.049504770049506,53.2608695652174,35.714285714285715,40.22496114321841,NA,NA,61.72458355471472,43.79681648876404,28.39036755513308,16.6189567426554,22.916666827083333,0.28780429293680293
66015063,approved,I really cannot agree with you. Las Vegas has a large LGTB community and is very welcoming to all.  Yet Nevada is a very conservative state with a live and let live attitude. ,1425583716,1,"Las Vegas,Nevada",NVFisherman,api.nytimes.com/svc/community/v2/comments/user/id/66015063.xml,1,14324528,0,10.181329105022716,17.18417101735436,20.454545270454545,22.01086956521739,10.150375939849624,0.0,36.166286,-115.149225,37.56285497529333,31.06239084269663,16.60794130418251,9.944790802579496,9.677419390322582,14.913623442379182
4030625,approved,"Kansas City. I\'d write more, but then the secret would be out.",1425583720,1,"Kansas City, Mo.",Michael Grimaldi,api.nytimes.com/svc/community/v2/comments/user/id/4030625.xml,1,14324629,0,3.3901068553467884,12.988112116264107,51.92307702692308,6.250000000000002,2.631578947368421,0.0,39.084469,-94.56303,57.798133936391295,35.24110485955056,22.00570342205323,8.082856233029606,0.0,0.2027712066914498
51675903,approved,"You paint an ideal picture for someone like me who enjoys hiking, biking, and nature. I have been in the programming side of tech since 1995. Most of my professional peers do not share my interest in recreation or being outside at all.  I discovered this reality early in my programming career and it holds true today. Are west coast techies are somehow different?",1425580569,2,Massachusetts,Gerry,api.nytimes.com/svc/community/v2/comments/user/id/51675903.xml,1,14324674,0,18.206155686606326,22.295823456055505,63.28125006328125,42.119565217391305,21.804511278195488,15.561139151014235,42.378877,-72.032366,51.72696650805918,41.85393258426966,24.55187398098859,18.777262817627253,0.0,0.20409650855018588
53402379,approved,Boston is a beautiful city - intellectual and cultured.  And the climate is no different realistically from NYC and Chicago.  As a result it has a very strong startup environment.,1425583724,0,boston,rjb_boston,api.nytimes.com/svc/community/v2/comments/user/id/53402379.xml,1,14324879,0,9.930913418660895,21.222579742921496,0.0,22.01086956521739,8.646616541353383,0.0,42.360482,-71.059568,25.81960845382484,31.20498415730337,16.43755484030418,9.907454981303008,7.051282142948718,2.666324830483271
71516068,approved,"I am surprised that the neither the NYT nor the commentators below bother to cite the extensive work done by organizations like the Kaufmann Foundation detailing the drivers of innovative ecosystems. It might seem obvious to some that being close to a research university is an advantage, but according to Kaufmann\'s analysis, factors like the size and concentration of the metro area, the percentage of college and high school degrees holders, and having deep roots in a or several particular industries is a far better predictor of the level of civic innovation and business formation<br/>. Data going back to the late 1980s shows that the same areas that led industries 2 1/2 decades ago continue to lead them today. Some of that is a refection of success begetting success leading to skills and capital concentrations that self-perpetuate leadership. Outside the US, countries have broken this cycle in a way that US private enterprise has not. South Korea, now a world power in several industries, was in the 1960s still an economic laggard recovering from war. How did they make the change? Vision, will, and the capability of invest in skills development over decades-- a long game. It\'s amusing to see cities throwing up tag lines and tossing a few dollars into an ecosystem believing that they can create the latest Silicon Valley (did you know there is Silicon Andes?) ",1425583740,3,Silicon Somewhere,The Skeptic,api.nytimes.com/svc/community/v2/comments/user/id/71516068.xml,1,14324933,0,32.42791563030034,52.129833207677514,8.653846283653847,88.04347826086956,85.33834586466165,24.663822014654155,NA,NA,19.8275855591954,91.01123595505616,85.93155893536121,5.438931297398534,0.0,0.0
46829521,approved,Unfortunately none of us can afford to live there.,1425583765,0,charlotte,rnahouraii,api.nytimes.com/svc/community/v2/comments/user/id/46829521.xml,1,14324947,0,0.42803632398119895,4.192412649430946,75.0,6.250000000000002,1.1278195488721803,0.0,35.227087,-80.843127,44.444185140739535,16.960894073033707,6.616781456273763,6.000244491927466,0.0,3.4249497226765793
10879693,approved,"I\'m a techie living in Boulder.  My experience has been that far more people leave Silicon Valley to live here than the opposite.  If your company takes off around here, it won\'t be an issue attracting STEM talent to the front range - see the previous sentence.",1425583773,3,Colorado,Chris,api.nytimes.com/svc/community/v2/comments/user/id/10879693.xml,1,14325053,0,34.79425129713404,65.29503240045005,28.125000253125,30.434782608695652,15.789473684210526,24.663822014654155,38.725178,-105.607717,42.8562482666625,31.179775280898877,19.07850592775665,18.2364167041086,0.0,0.8315398163568773
60365678,approved,"Why does location matter in the age of high bandwidth internet?<br/>Can\'t everything that is done in Silicon Valley be done in Mumbai,<br/>Seoul, Tokyo, Shanghai et al?  Can\'t a tech entrepreneur or entrepreneurs<br/>source engineers, designers and marketers anywhere in the world and produce<br/>innovative products?  Perhaps all of this location talk is an illusion.<br/>Perhaps Silicon Valley remains a tech hub because it is cool to live there.",1425583780,2,Las Vegas,Orrin Schwab,api.nytimes.com/svc/community/v2/comments/user/id/60365678.xml,1,14325071,0,55.96268968092653,84.92884848514076,0.0,42.119565217391305,24.06015037593985,15.561139151014235,36.166286,-115.149225,27.54793426189036,55.178225505617974,37.7160088973384,12.12819162793159,22.758620477241383,2.4501520780669144
48750003,approved,Do you think taxes in California are less?,1425584575,3,"Chevy Chase, MD",Benbo81,api.nytimes.com/svc/community/v2/comments/user/id/48750003.xml,1,14325248,0,0.0,22.890375125311685,0.0,6.250000000000002,0.7518796992481203,24.663822014654155,38.993207,-77.074383,48.85572009466003,21.688006264044944,11.725174638783269,11.931919048076416,0.0,0.5512113828996282
71516588,approved,"While it maintains much of its blue collar sensibility, Pittsburgh is no longer a blue collar town.  Rather it has one of the most highly educated working age populations in the country that includes a vibrant tech scene.  The only tech company that I know of in recent years that went to the Silicon Valley was ModCloth and the only moved their HQ administrative jobs.  Their technology operations are still in Pittsburgh.  Then again, he left Pittsburgh in 2004 and it\'s obvious he has not been back.",1425585428,2,Pittsburgh,JimF,api.nytimes.com/svc/community/v2/comments/user/id/71516588.xml,1,14325493,0,42.21834469327753,62.421001106661855,7.670454307670455,51.630434782608695,30.82706766917293,15.561139151014235,40.441694,-79.990086,17.624521348914435,53.370786516853926,30.79847908745247,3.6259541982656893,0.0,0.0
15694822,approved,"I would disagree.  Boston summers would be ok, but the winters are ghastly especially this year.",1425588331,3,Ny,Unam,api.nytimes.com/svc/community/v2/comments/user/id/15694822.xml,1,14325624,0,0.4791797551633954,9.843719194075689,42.1875000421875,18.75,3.7593984962406015,24.663822014654155,43.156168,-75.844995,36.2349637690965,13.915582499999998,6.859115467680608,4.150763358159307,0.0,1.765799256505576
11290709,approved,"Boston and NYC, despite their magnificent universities, are both disadvantaged due to their cold winters and stifling summers, ultimately the effect of the Coriolis force which priviliges the West Coast over the East Coast. Similarly, the West Coast of Europe is warmer than Canada even though both are roughly at the same distance from the equator. Geography is (to a large extent) destiny!",1425587587,3,"Kansas City, MO",cj,api.nytimes.com/svc/community/v2/comments/user/id/11290709.xml,1,14325798,0,1.9736822940925167,12.26712281013333,0.0,39.94565217391304,21.428571428571427,24.663822014654155,39.084469,-94.56303,1.2724765392715573,48.82022471910112,30.722433460076044,13.77862595340962,0.0,0.2655337226765799
71516586,approved,"I just moved to Orlando from NJ. (no NJ jokes plz). I own a tech business. I moved to Lake Mary; 60 seconds from the new $21 million Verizon building. Across street from Deloitte and Symantec. I work in downtown Orlando at Canvs in a co-working space for tech startups. I can go on and on about the companies doing business here, the tech infrastructure and the ridiculous ongoing investments in it ... but with this 85 degree weather right now ... I think I\'ll go for a stroll at Lake Eola Park.",1425587889,2,Orlando,NJtoOrlando,api.nytimes.com/svc/community/v2/comments/user/id/71516586.xml,1,14325838,0,77.21962128164012,64.27464836639878,50.80645152580645,44.02173913043478,32.70676691729323,15.561139151014235,28.542118,-81.379046,100.0,45.50561797752808,32.69961977186311,3.6259541982656893,0.0,0.0
66015063,approved,You make statements that are not true. Having lived in Las Vegas for ten years I have found it to it very accepting of every nationality. It has a large Asian and gay community.  ,1425588868,3,"Las Vegas,Nevada",NVFisherman,api.nytimes.com/svc/community/v2/comments/user/id/66015063.xml,1,14325966,0,10.621984325678493,14.815547670237482,19.85294139485294,25.0,10.526315789473683,24.663822014654155,36.166286,-115.149225,37.56285497529333,31.06239084269663,16.60794130418251,9.944790802579496,9.677419390322582,14.913623442379182
46945060,approved,Seattle is more diversified than San Jose/Silicon Valley. That\'s more valuable than the pundits care to point out.<br/>Also there are some of us who don\'t think a place as arid and as brown as the San Francisco Bay region as a great place to live. ,1425591987,3,Seattle,vacciniumovatum,api.nytimes.com/svc/community/v2/comments/user/id/46945060.xml,1,14326026,0,40.228896758452606,60.29585703684347,13.500000013500001,37.77173913043478,16.165413533834585,24.663822014654155,47.603832,-122.330062,68.69441158724058,42.94882488764044,30.66133129657794,24.44748158638659,17.772925482227077,11.055858639405203
12460360,approved,"When I moved from Washington DC to Venice California in the late 1970s, I called my new home \""the land of no shame.\"" I found California to be a place of new ideas, anything on the table, and let\'s do it. With this freedom comes creativity, and therefore a place that I will never leave.",1425591999,6,Los Angeles,Leslie,api.nytimes.com/svc/community/v2/comments/user/id/12460360.xml,1,14326117,0,2.538550281116654,18.781252449851706,60.26785701026786,27.989130434782613,18.796992481203006,40.22496114321841,34.053717,-118.242727,89.02227321543728,21.619181376404494,11.841390547528515,13.014585605266339,19.64285728035714,0.24206795167286244
63308351,approved,"I read the comment of someone making the case for Cleveland being the next \'tech hub\', and while I acknowledge that weather, the beautiful surroundings (CA has 13 National Parks), the \""progressive\"" political environment (at least on the coast) isn\'t \'everything\'.. I do have to say it\'s a lot.  About my only regret about moving to California is that I didn\'t do it sooner.    It\'s the butt of jokes for people who don\'t live here.. but without it\'s engine (with all due respect to New York and Texas) the Country would be a whole lot poorer.    Where do the venture capitalists live?",1425592022,9,san francisco,acrftr,api.nytimes.com/svc/community/v2/comments/user/id/63308351.xml,1,14326273,0,23.63830982422631,39.55715012050341,30.681817905681818,47.82608695652174,38.34586466165413,49.32764400685833,37.779277,-122.41927,49.28318122998818,29.48216901685393,19.4577616121673,22.30750083555491,0.0,0.7434944237918215
