UserID,Status_Accepted,commentBody,ApproveDate,RecommendationCount,Location,DisplayName,UserComments,TimesPeople,CommentSequence,EditorsSelection,ArticleRelevance,ConversationalRelevance,PersonalXP,Readability,Brevity,RecommendationScore,Latitude,Longitude,AVGPersonalXP,AVGReadability,AVGBrevity,AVGRecommendationScore,AVGPicks,AVGcommentspermonth
63984680,approved,"I\'ve been reading \""What\'s the next Silicon Valley?\"" articles since the 1970s, when they used to be \""What\'s the next Silicon Valley / Route 128?\"" articles. All that\'s happened since then is that Route 128 (suburban Boston) lost out badly to Silicon Valley. <br/><br/>The reality is that all the information superhighway hype about how you didn\'t have to live anywhere in particular to do your job turned out backwards. Getting to the top is really about where you live and who you spend time with in person.",1425547472,39,America,Steve Sailer,api.nytimes.com/svc/community/v2/comments/user/id/63984680.xml,1,14319463,0,37.258044664659224,0.0,7.258064407258065,45.92391304347826,31.954887218045112,82.24687934166865,51.447704,5.966069,19.483758557590875,34.9545431741573,18.79971356273764,15.483307273159351,8.02155969197844,26.055349026022302
40255154,approved,"Agreed, Steve Sailer. Note, too, that for all the talk of disruption, Silicon Valley\'s status as the epicenter of tech development has grown over decades from historical roots in the military and electronics industries based there at least since the 1950s. You might even say that Silicon Valley evolved \""organically\"" (irony) which helps explain why cities can\'t become \""the new Silicon Valley\"" by waving a few tax breaks and an ad campaign.",1425553927,33,Philadelphia,Doug Hill,api.nytimes.com/svc/community/v2/comments/user/id/40255154.xml,1,14319878,0,56.95611599630664,0.0,0.0,42.119565217391305,25.563909774436087,78.49651876358767,39.952335,-75.163789,38.27165211193438,43.107841994382014,27.658657049429657,18.428818753715905,22.680412127319588,0.8484583427509294
705268,approved,"There is no next Silicon Valley...it\'s like naming the next Wall Street...driving the 101 between SF and SJ is a fantasy--gleaming office buildings with the names of American companies on them that you\'ve never heard of...but I\'ll give 3 answers..1)The Austin Texas model...big state schools, get an anchor company, and develop from there...2)The \""Me Too\"" Model..New York, which will be an epicenter because a lot of money is here, and people just want to live here, and 3)my favorite, the \""American Bangalore\"", which I favor Rochester--places where really good young talent is produced every year and where the economics make more sense than hiring in India",1425570092,3,"Westfield, NJ",Mike,api.nytimes.com/svc/community/v2/comments/user/id/705268.xml,1,14319995,0,22.224064454431876,53.554822278679495,22.31404944731405,51.630434782608695,43.233082706766915,24.663822014654155,40.658991,-74.347372,23.594899710109534,38.15543070224718,27.57710181749049,8.359838845800008,15.277777884722223,0.4536576148698885
11223833,approved,"Salaries in Florida are low, and Orlando salaries are lowest among the major Florida cities.  My son graduated from UCF in Orlando about a decade ago.  The placement office told him that if he wanted to make real money, he would have to leave Florida.  There is a budding start up scene in Orlando and a rapidly growing downtown.  But the reality is that Orlando is a blue collar city that provides an army of low wage workers to support the tourists at the parks and I drive.  If you have a lot of ambition and strong tech skills, there is no reason to stay in Orlando and every reason to go west young man, go west.",1425570103,18,DC,John Smith,api.nytimes.com/svc/community/v2/comments/user/id/11223833.xml,1,14320084,0,97.03295924536187,4.379371650632579,23.076922973076922,47.82608695652174,41.72932330827067,64.88878315787257,38.893715,-76.987793,36.99554463931255,58.06100025280899,46.904799049429656,17.94103836023238,32.9652999170347,2.772796851301115
38130104,approved,"Growing up in Florida I could not wait with my technology skills to leave to go....guess where?  San Francisco and in 1986  I never looked back.  I remembered an article a few years later indicted that for every 10 people who moved to Florida over the age 65, 7 people under the age of 30 moved out. <br/><br/>I recently went to Orlando with my spouse who was attending a conference and I was astounded at how Orlando had grown with massive highways and never ending ugly malls and expanding theme parks.  After a few days there visiting one chain place after another, one ugly mall after another, I realized that Orlando had no soul no vibe other than the sounds of never ending traffic.  No individualism or sense of city spirit beyond marketing tourism for Europeans, South Americans or obese Americans who are there for the magic of discounted malls or a theme park a day.  After a lovely day of doing both they head with excitement to visit their favorite chain restaurant serving predictable plastic food that they can get anywhere in the US.   What a vacation and what a place to live.",1425557226,86,SF,SFjoe,api.nytimes.com/svc/community/v2/comments/user/id/38130104.xml,1,14320141,0,62.08581284774216,59.52720317968841,34.26395920926396,67.3913043478261,71.05263157894737,99.99999999999999,37.779277,-122.41927,57.12703379992616,66.49041640449438,57.14605231939163,41.91176470561573,0.0,0.24783147434944236
7890860,approved,California ha a very big advantage in job mobility for workers because employee non-compete agreements are essentially unenforceable.<br/><br/>Here in Massachusetts I and a number of my friends in high tech have been threatened by our previous employers. Some have had to wait for a year to take a job in a related area after quitting a job.,1425558607,31,"lexington, ma",bentsn,api.nytimes.com/svc/community/v2/comments/user/id/7890860.xml,1,14320265,0,23.911652607896777,5.972898810510392,44.262294794262296,22.01086956521739,19.924812030075188,77.09293810753637,42.447318,-71.2245,35.01629803007606,30.43274081460674,14.561678182509505,36.20902558762162,27.24458217275542,3.382376040892193
67432250,approved,I\'m disappointed there is no mention of San Diego. Forbes even named it the top city to bring your start-up for 2014.,1425570107,1,CA,Ryan,api.nytimes.com/svc/community/v2/comments/user/id/67432250.xml,1,14320311,0,12.424889954558516,8.340953828422792,28.125000253125,18.75,6.7669172932330826,0.0,61.066692,-107.991707,0.0,19.382022471910112,6.4638783269961975,1.8129770991328447,0.0,0.0
3660662,approved,"In regards to Florida\'s comment about Pittsburgh\'s failure to become a high tech hub, I really do not understand his citing \""lifestyle reasons\"" as one of the reasons. The area has consistently been rated as a great place to live and in the 8 yrs. since my return is only getting better.",1425570112,14,"Pittsburgh, PA",Bill S,api.nytimes.com/svc/community/v2/comments/user/id/3660662.xml,1,14320388,0,40.72872139480058,19.252076277567923,25.000000000000004,37.77173913043478,18.045112781954884,59.246779710461084,40.441694,-79.990086,51.172649638805694,34.8876404494382,17.490494296577946,10.515267174970498,0.0,0.06521880892193309
59610530,approved,"Why should anyone desire to be the \""Next Silicon Valley?\"" It\'s reminiscent of all those cities of yore calling themselves \""The Paris of the East\"" instead of capitalizing on their own unique features and identities. <br/><br/>Silicon Valley arose from a unique mix of universities, corporations and venture capital firms, and the fact that all these were in the same geographic area. Instead of trying to mount the impossible task of copying those elements in just the right way, these other cities should be looking at what they already have and finding ways to capitalize on it in ways nobody else can.",1425560167,54,New York,AD,api.nytimes.com/svc/community/v2/comments/user/id/59610530.xml,1,14320420,0,34.96994122578615,49.572940579964424,0.0,63.04347826086956,36.09022556390977,89.55260517252671,40.730599,-73.986581,28.619774133558945,62.82136735955056,49.76348520912548,49.46047353438203,42.881356057118644,8.123365003717472
40343536,approved,Does the NSA data center actually employ a lot of people in Utah??<br/><br/>Looking at the photo I see big big buildings but only 2 relatively small parking lots.  Do they let people work from home?,1425570151,10,usa,seeing with open eyes,api.nytimes.com/svc/community/v2/comments/user/id/40343536.xml,1,14320445,0,19.44395899035768,10.97895087310671,17.763157592763157,18.75,11.278195488721805,51.69298530152148,39.78373,-100.445882,41.3497497929655,34.415507696629206,20.372110041825092,26.115520902130786,6.89446009310554,22.699527286245353
66015063,approved,A number of high tech companies are investing here in Las Vegas. We have a very good tax structure and excellent infrastructure. Compare a 13% California state income tax with a Nevada zero income tax.  Housing is affordable and of course some the best restaurants/entertainment in the country.  You are talking about a 45 minute plane ride to most of Silicon Valley from Las Vegas.,1425560768,2,"Las Vegas,Nevada",NVFisherman,api.nytimes.com/svc/community/v2/comments/user/id/66015063.xml,1,14320508,0,39.434625146919096,39.48935376262909,10.227272635227273,35.32608695652174,22.55639097744361,15.561139151014235,36.166286,-115.149225,37.56285497529333,31.06239084269663,16.60794130418251,9.944790802579496,9.677419390322582,14.913623442379182
66015063,approved,"Great comment. I have never been to Orlando and based upon your comment I hope that I never have to go that city. I prefer \""sin city\"".",1425570190,2,"Las Vegas,Nevada",NVFisherman,api.nytimes.com/svc/community/v2/comments/user/id/66015063.xml,1,14320531,0,70.2716260754714,73.48917207027176,100.00000000000001,11.141304347826086,7.894736842105263,15.561139151014235,36.166286,-115.149225,37.56285497529333,31.06239084269663,16.60794130418251,9.944790802579496,9.677419390322582,14.913623442379182
51581368,approved,"Technology is to the Bay Area what the Renaissance was to Florence. Silicon Valley is attracting America\'s best and brightest.<br/><br/>Strip away the technology and the Bay Area offers the most attractive quality of life in the world given our weather and natural beauty. Combine the three and you dominate for the next 100 years.<br/><br/>That said, there is a major shift within the Bay Area. Silicon Valley is making its way north. San Francisco is the new tech capital of the world.  The kids may work in San Mateo county and San Jose but they want to live in San Francisco. <br/><br/>The appeal of this special area of the world is dwarfs all others. ",1425570217,32,"San Francisco, CA",Joe Aaron,api.nytimes.com/svc/community/v2/comments/user/id/51581368.xml,1,14320759,0,52.17401461381351,55.58608022037605,5.532786680532787,58.423913043478265,41.35338345864661,77.80569571017122,37.779277,-122.41927,87.74624394281581,29.258426966292134,18.250950570342205,6.2003816790343285,21.999999978,0.8081461130111524
52147740,approved,"\""We have a very good tax structure and excellent infrastructure.\""<br/><br/>And the worst school system in the United States. I\'ll pay 13% and take California.",1425563708,45,"annapolis, md",george eliot,api.nytimes.com/svc/community/v2/comments/user/id/52147740.xml,1,14320966,0,1.23372303008298,16.543261279168664,48.21428547321428,18.75,7.518796992481203,85.45949017981556,38.97864,-76.492786,35.85171630064134,27.22206008426966,14.320829148288972,46.300243438188915,6.349206593650793,0.9368029739776951
647120,approved,Where are the biotechnology hubs going to be?,1425570229,1,Minnesota,Steve S,api.nytimes.com/svc/community/v2/comments/user/id/647120.xml,1,14321172,0,15.54382385181611,6.085080961986584,0.0,6.250000000000002,0.7518796992481203,0.0,45.989659,-94.611329,40.45008485543373,25.639188258426966,14.8521766121673,22.64371397580284,11.22448963877551,1.1384758364312266
14442276,approved,"A Stanford law professor has argued persuasively that the key to Silicon Valley success is that California strongly discourages non-competition clauses in employment agreements. The benefit is that employees can move easily to new companies, benefiting the tech environment generally. Most of the other states mentioned allow enforcement of non-competition agreements. Thus, as with Route 28 outside Boston, the early computer industry conglomeration, innovators moved elsewhere. Those who want to emulate California need to think first about changing their state law.",1425564908,33,"Gallatin Gateway, Montana",Dave Anderson,api.nytimes.com/svc/community/v2/comments/user/id/14442276.xml,1,14321221,0,31.521695774810574,46.87336082565736,0.0,61.413043478260875,28.94736842105263,78.49651876358767,45.591596,-111.19773,24.427574847328685,31.91713483146067,16.397338403041825,31.72709923482478,0.0,0.09441199033457248
64878340,approved,"Even Montreal is trying to be Silicon Valley, despite some advice to the contrary.<br/><a href=\""http://montrealgazette.com/business/apple-co-founder-steve-wozniak-to-montreal-dont-try-to-be-silicon-valley\"" title=\""http://montrealgazette.com/business/apple-co-founder-steve-wozniak-to-montreal-dont-try-to-be-silicon-valley\"" target=\""_blank\"">http://montrealgazette.com/business/apple-co-founder-steve-wozniak-to-mo...</a>?",1425570247,0,Linden,Ichigo Makoto,api.nytimes.com/svc/community/v2/comments/user/id/64878340.xml,1,14321262,0,33.74159707710579,68.62651005665595,0.0,37.77173913043478,3.3834586466165413,0.0,33.009572,-94.36675,44.22679680639172,19.34486654494382,8.061238859315589,9.93780039437379,8.730158791269842,3.3457249070631967
66015063,approved,If that is true why isn\'t New Jersey\'s tech environment growing? The courts of New Jersey pretty much disregard non-competition agreements.,1425570293,1,"Las Vegas,Nevada",NVFisherman,api.nytimes.com/svc/community/v2/comments/user/id/66015063.xml,1,14321483,0,19.7931059457556,18.671309861417356,0.0,18.75,6.7669172932330826,0.0,36.166286,-115.149225,37.56285497529333,31.06239084269663,16.60794130418251,9.944790802579496,9.677419390322582,14.913623442379182
66015063,approved,Actually most parents in the tech sector in Las Vegas send their children to private schools;these are comparable in quality to private schools anywhere in the USA. The tax savings easily pay for private school education expenses.,1425566228,4,"Las Vegas,Nevada",NVFisherman,api.nytimes.com/svc/community/v2/comments/user/id/66015063.xml,1,14321535,0,27.767663754530854,26.133674416928148,17.763157592763157,30.434782608695652,12.030075187969924,31.122278279578495,36.166286,-115.149225,37.56285497529333,31.06239084269663,16.60794130418251,9.944790802579496,9.677419390322582,14.913623442379182
69126622,approved,"1000+Computer programmer &amp; database administrator jobs in Austin. The job demand for those are so great, Austin tech/govt employers had to partner with Austin Community College to create an accelerated certificate/degree program.",1425570296,4,"Austin, TX",Brian C.,api.nytimes.com/svc/community/v2/comments/user/id/69126622.xml,1,14321566,0,12.977070998933184,15.441041847933674,19.285714594285714,27.989130434782613,10.902255639097744,31.122278279578495,30.271129,-97.7437,35.64973949969878,23.562458679775283,10.579288749049429,24.741805111178902,0.0,1.2639405204460965
42827947,approved,What about the kids that have to go to the public schools?,1425570329,6,Somewhere In IL,Not A Victim,api.nytimes.com/svc/community/v2/comments/user/id/42827947.xml,1,14321596,0,0.8474225901152915,5.41551954195012,0.0,6.250000000000002,2.2556390977443606,40.22496114321841,NA,NA,67.76010404954715,24.700278005617978,12.951929231939163,19.363343036105153,7.560137192439862,7.211895910780668
63752771,approved,"California has the environmental and business climate that smart people like.  I think other cities need to look at their strengths and weakness to become their own success.  I would never consider living in Florida year round, and while Seattle has its share of rain, it is a city with a great personality, so I would consider living there.  Give your city an appealing personality. Make it real.",1425566589,9,"Sacramento, Calif.",JoeB,api.nytimes.com/svc/community/v2/comments/user/id/63752771.xml,1,14321618,0,9.319948106457515,23.966135182451257,29.779411754779414,45.92391304347826,23.308270676691727,49.32764400685833,38.581572,-121.4944,48.97491682854962,43.85314671348314,29.601730790874523,31.161043692872457,43.32073070667927,26.220570014869885
65260364,approved,I understand totally.  I have relatives who relocated to central Florida to escape the winter.  Many times they tried to recruit me to move.   After a week or so I\'m ready to leave.  I tried to see myself living there but I just can\'t see it.  Soul-less indeed.,1425571586,7,New York,Andre,api.nytimes.com/svc/community/v2/comments/user/id/65260364.xml,1,14321634,0,5.223367105519115,14.80517281428093,92.64705894264706,25.0,16.917293233082706,43.685640559446846,40.730599,-73.986581,23.39306704250098,27.8320654494382,15.223666779467678,5.343274927175003,4.479461795520538,53.836621866171
39924852,approved,"You\'re absolutely right. It\'s very difficult, if virtually impossible to overcome (or even rival) the advantages of an incumbent. Hollywood is still the center of the entertainment industry and New York City is still the center of finance. And both evolved into those positions through a very \""organic\"" process. The other cities mentioned are (or have been) the center of very different industries; Orlando and tourism and Pittsburgh and industrial production.",1425566648,11,New York City,Fred,api.nytimes.com/svc/community/v2/comments/user/id/39924852.xml,1,14321639,0,52.17221770311147,41.84084179436601,0.0,39.94565217391304,25.18796992481203,53.832696771383496,40.730599,-73.986581,30.112713340525996,32.04817508426966,18.308937433460073,17.71898750862296,10.784313639215686,4.739776951672862
65260364,approved,Very true... Though Route was very successful it\'s own right... Just like in the Bay Area with San Fran seeing faster growth - Boston/Cambridge is where the growth is in that area.,1425571627,0,New York,Andre,api.nytimes.com/svc/community/v2/comments/user/id/65260364.xml,1,14321667,0,12.035473926414761,27.97646308690531,0.0,27.989130434782613,10.150375939849624,0.0,40.730599,-73.986581,23.39306704250098,27.8320654494382,15.223666779467678,5.343274927175003,4.479461795520538,53.836621866171
14442276,approved,You hit the nail on the head.,1425571642,2,"Gallatin Gateway, Montana",Dave Anderson,api.nytimes.com/svc/community/v2/comments/user/id/14442276.xml,1,14321687,0,0.0,1.1702145144658864,0.0,0.0,0.37593984962406013,15.561139151014235,45.591596,-111.19773,24.427574847328685,31.91713483146067,16.397338403041825,31.72709923482478,0.0,0.09441199033457248
20413827,approved,"Mr. Florida seems to take any opportunity to slight Pittsburgh. The city ranks 24th out of 100 metro areas in number of advanced industry jobs, according to the Brookings report cited in the article. Not great, but not bad. Allowing personal prejudice to cloud professional judgment may land Mr. Florida in his own cautionary tale.",1425571648,1,NY,Ginzberg,api.nytimes.com/svc/community/v2/comments/user/id/20413827.xml,1,14321689,0,20.740194290219428,26.506740980330203,0.0,33.15217391304348,18.421052631578945,0.0,43.156168,-75.844995,46.72634328472294,33.23970036516853,19.188846642585553,17.501272263024735,29.333333120666666,0.6638343070631969
8543514,approved,"NVFisherman espouses the idea that \""it\'s fine that most of my kid\'s friends go to crummy [public] schools, as long as my kid goes to a good [private] school\"".  As a father, I recommend against this thinking.  Your kid\'s friends will influence him/her in a very negative way.",1425571655,10,"Wakeman, Ohio",Dan Styer,api.nytimes.com/svc/community/v2/comments/user/id/8543514.xml,1,14321696,0,0.5437477397172343,5.11758445388328,77.88461520288462,33.15217391304348,17.293233082706767,51.69298530152148,41.254587,-82.399659,34.06460095896814,37.44860081460674,20.781434376425853,20.618329096147804,10.400444989599556,7.772110312267658
64733832,approved,"I\'d keep an eye on Philadelphia. Not only is there a hugely active independent tech scene (whose epicenter is roughly N. 3rd Street, or as they actually officially ordained it last year, \""N3RD St.\""), but Comcast is doubling down on the   city with a brand new tower under construction that will employ 2,000 tech workers. Regardless of what you think of the company, it\'s growing like crazy and Center City Philadelphia is filled with young workers in this and other technology companies.",1425571662,0,"Collingswood, NJ",Joseph,api.nytimes.com/svc/community/v2/comments/user/id/64733832.xml,1,14321719,0,29.078225981493034,33.10653095294363,7.941176557941176,42.119565217391305,29.69924812030075,0.0,39.918169,-75.071284,62.63219115895023,32.162921348314605,22.73221075665399,21.367230104692712,39.28571401071429,0.281322214126394
45782424,approved,"There always will be Megatrends about how and where technology evolves. Few want to remember Menlo Park in Edison,NJ where in a barn like structure,Thomas Edison worked on his illumination device with a tungsten filament perfected later by Louis Latimer,an African American,son of a former slave. Anyway,Florida has a lot of areas beyond Orlando where technology is growing and a secretive bunch near Ft.Lauderdale is developing Leap Magic. In Odessa,a nanotechnology firm Dais Analytics is working on water membranes,battery storage and better air handling systems that China loves. In Tarpon Springs,Magnegas is making progress on welding gas from waste material. So,with the economy rebounding and our infamous Governor Scott touting Jobs all the time,deal makers are taking a close look beyond the malls and palm trees and beaches and golf courses down here for good,future profitable reasons. Including Fortress Group,helping to build the Miami-Orlando railroad line. As Jim Dooley used to pitch for Tropicana juice,\""Come on down....\""",1425571687,1,Palm Harbor,mark,api.nytimes.com/svc/community/v2/comments/user/id/45782424.xml,1,14321903,0,41.080808662647115,41.144740624054876,7.848837232848838,84.51086956521739,62.40601503759398,0.0,28.078072,-82.763713,32.35308968431442,63.23629553370786,48.92844798479087,8.59790654511844,16.666666483333334,1.0440559992565055
55516297,approved,"Silicon Valley is a product of several factors: close nit relationship with the very very best universities in the World and National Labs, progressive laws and politics, open and collaborative professional culture, a long legacy in high tech, and fame around the World.<br/><br/>I frankly do not think it can be \""reproduced\"" anywhere else in the US. At best, we will have pockets of \""mini SV\"" in the East Coast (Mass, NY) and a few central states.",1425568809,7,"Palo Alto, CA",R. Teixeira,api.nytimes.com/svc/community/v2/comments/user/id/55516297.xml,1,14322107,0,32.28486865555672,42.45735156071839,25.632911725632912,42.119565217391305,26.69172932330827,43.685640559446846,37.442156,-122.163447,28.383036665787508,23.43287994382022,9.905943566539925,100.0,28.94736842105263,0.6141910460966542
70264887,approved,At which point you have no advantage.,1425571706,1,"Santa Fe, NM",kaneable,api.nytimes.com/svc/community/v2/comments/user/id/70264887.xml,1,14322142,0,3.9577672121662713,6.313726298549377,0.0,0.0,0.37593984962406013,0.0,35.649296,-105.922455,0.0,0.0,0.0,1.8129770991328447,0.0,0.0
4569526,approved,"If we\'ve learned anything from Silicon Valley, it\'s that Technologists, and related companies, are not going to locate in areas where the political, environmental, and social atmosphere is not progressive and tolerant.  Las Vegas and Florida and Ohio do not present tolerant, progressive communities. Rather they have governments that cling to 19th century viewpoints that are simply not tolerable by today\'s technology elite. Like it or not, today\'s technologists are almost universally aligned with blue-state values.<br/><br/>Want to attract technology companies? Create communities where quality of life and progressive politics thrive.  That\'s why you see Boulder, Austin, San Francisco, New York, Seattle, and a few other areas reaping the benefits.",1425571732,58,New York City,David Tussey,api.nytimes.com/svc/community/v2/comments/user/id/4569526.xml,1,14322158,0,31.601526509759932,53.5978034932749,5.720338805720338,71.73913043478261,41.35338345864661,91.15685736148761,40.730599,-73.986581,46.650168817700795,39.58347185393258,23.69563750190114,30.595329498248354,68.34319518165681,0.9105112869888474
48054569,approved,"Provo is an interesting example.  In the end the advantage of \""people wanting to be there\"" may be self-limiting.  If you\'re a Mormon IT person, all is well.  But Provo and Utah County are overwhelmingly LDS, notoriously insular and socially regressive.  Horror stories abound of non-Mormons leaving after their kids are ostracized in school.  I\'d add that tolerance of diversity is also a prerequisite.  All the other tech incubatoriums have it in large measure, Provo does not. ",1425571742,32,South Korea,MHR,api.nytimes.com/svc/community/v2/comments/user/id/48054569.xml,1,14322225,0,24.414821818594735,16.11386662523222,8.333333333333334,47.82608695652174,28.19548872180451,77.80569571017122,35.398501,127.937111,42.80658819976408,30.98080525280898,21.974017745247146,25.381679387859826,22.916666827083333,0.22587172342007433
