userID,status,commentBody,ApproveDate,recommendationCount,location,display_name,userComments,times_people,commentSequence,editorsSelection,ArticleRelevance,ConversationalRelevance,PersonalXP,Readability,Brevity,RecommendationScore,latitude,longitude,AVGPersonalXP,AVGReadability,AVGBrevity,AVGRecommendationScore,AVGPicks,AVGcommentspermonth57101688,approved,"The law applies throughout California, so discouragement of non-competition clauses cannot be \""the key\"".",1425571788,1,Los Angeles,Gary,api.nytimes.com/svc/community/v2/comments/user/id/57101688.xml,1,14322388,0,0.004609355,0.081091406,0,11.6,15,0,34.053717,-118.242727,0.022894079,17.68469751,56.22064057,14.28469751,0.014234875,4.39062559763575,approved,"I agree. Central Florida is a horror: all asphalt (the vast, empty parking lots, the six lane roads) and strip malls, most of them decrepit. There are cars on the beaches. Rarely does a community zone a commercial district to encourage and protect local businesses and restaurants. It\'s all sprawl. There\'s no there there. No one with any interest in having a real life would ever move there voluntarily.",1425569951,13,CO,Contingent,api.nytimes.com/svc/community/v2/comments/user/id/59763575.xml,1,14322408,0,0.020596994,0.090461893,0.014084507,20.7,71,2.564949357,2.893078,-73.784507,0.033811322,19.47761194,75.73134328,8.029850746,0.029850746,1.116666667583542,approved,"And how do you propose to live, never mind become the next \""Silicon Valley\"" without drinking water?",1425570368,9,"Banks, OR",RichWa,api.nytimes.com/svc/community/v2/comments/user/id/583542.xml,1,14322508,0,0.228274493,0.367801395,0,10.1,17,2.197224577,45.618729,-123.114209,0.028826719,25.19555723,109.435994,15.6310241,0.027861446,17.0256410359183455,approved,Public schools in California are terrible. ,1425571855,3,Bellerose NY,Chris,api.nytimes.com/svc/community/v2/comments/user/id/59183455.xml,1,14322563,0,0.001757872,0.078912127,0,6,6,1.098612289,40.724269,-73.715131,0.01010101,12.10909091,23,10,0,0.26190476263859870,approved,"Perfect example of the fortress-like mentality of aspiring 1 per centers. Don\'t want to pay taxes and really don\'t give a darn about the public school system because, hey, I can send my kids to private schools. Hard to imagine true creativity flourishing in such an environment.",1425570608,26,"Los Angeles, CA",kb,api.nytimes.com/svc/community/v2/comments/user/id/63859870.xml,1,14322576,0,0.020064106,0.063369579,0.04,19,50,3.258096538,34.053717,-118.242727,0.024912898,23.33191489,93.89361702,12.62411348,0.028368794,3.20454545565428171,approved,"Come on, wake up folks. It\'s going to be Silicon Beach: Venice California.",1425572329,1,"Venice, CA",Patrick,api.nytimes.com/svc/community/v2/comments/user/id/65428171.xml,1,14322612,0,0.107476951,0.198730227,0,10.1,14,0,33.995044,-118.466888,0.0258114,13.38627451,29.43137255,8.176470588,0.019607843,1.34210526363627949,approved,Boston/Cambridge and San Diego already seem to have a large number of those types of companies.,1425572342,3,NY NY,Jason A.,api.nytimes.com/svc/community/v2/comments/user/id/63627949.xml,1,14322627,0,0.052728417,0.109893437,0,12.9,17,1.098612289,43.156168,-75.844995,0.034955569,18.72,60.96,19.44,0.06,1.315789474331287,approved,The largest concentration of biotech is also in the Bay Area.  For many of the same reasons as Silicon Valley.,1425572371,13,California,David,api.nytimes.com/svc/community/v2/comments/user/id/331287.xml,1,14322653,0,0.2117088,0.317318395,0,12.9,20,2.564949357,36.701463,-118.755997,0.02116836,14.98632539,37.75806452,8.619915849,0.028751753,71.352856709,approved,"You lost me after using \""data\"" as a singular noun.",1425572374,1,"Rochester, NY",Dave,api.nytimes.com/svc/community/v2/comments/user/id/52856709.xml,1,14322682,0,0.011328,0.005337391,0.1,10.1,10,0,43.185475,-77.610686,0.033345785,19.57109515,72.28186715,7.251346499,0.055655296,7.73611111127034584,approved,"Exactly.  Even those of us who live in the former \""Northern California\"", aka \""Silicon Valley\"" are sick of the cartoon and the high tech name dropping.  NoCal is exquisitely gorgeous and is and has been a wonderful place to live long, long, long before the former military industrialist contractors and SRI converted to consumer products.<br/><br/>On this topic, I am in full agreement with Texas governor Rick Perry:  Go To Texas.  They say it is very, very wonderful there.  Go.  Please.  I think you will be happier in some other Silicon Valley.",1425572419,1,Northern Cal,Paul,api.nytimes.com/svc/community/v2/comments/user/id/27034584.xml,1,14322734,0,0.207059311,0.306840175,0.031914894,22.2,92,0,NA,NA,0.023138667,27.05086505,129.5536332,7.505190311,0.051903114,3.284090909331287,approved,"I\'ve lived in the Bay Area and worked for tech companies for over 30 yrs.  I\'ve done the research about jobs, investment, VC money, etc.  This is the first article I seen in the NYT that gets it right.  When it comes to technology, there is really no where else that comes close.  If you want to be a first rate banker, go to NY or London.  If you want to be a famous movie star, go to LA.  If you want to do cutting edge technology come here.",1425572427,20,California,David,api.nytimes.com/svc/community/v2/comments/user/id/331287.xml,1,14322848,0,0.122814722,0.173736923,0.032967033,21.5,91,2.995732274,36.701463,-118.755997,0.02116836,14.98632539,37.75806452,8.619915849,0.028751753,71.355555222,approved,"I hope they did an area ground sounding to preclude the possibility of sinkhole(s).<br/><br/>Sinkholes map of Orange County, Florida , 2008<br/><br/><a href=\""http://fcit.usf.edu/florida/maps/pages/11100/f11148/f11148.htm\"" title=\""http://fcit.usf.edu/florida/maps/pages/11100/f11148/f11148.htm\"" target=\""_blank\"">http://fcit.usf.edu/florida/maps/pages/11100/f11148/f11148.htm</a>",1425572432,3,"Lima, Ohio",augustborn,api.nytimes.com/svc/community/v2/comments/user/id/55555222.xml,1,14322858,0,0.044080151,0.067504283,0.015384615,19,23,1.098612289,40.742551,-84.105226,0.019161192,24.34485294,98.21323529,5.453431373,0.019607843,5.368421053331287,approved,"You raise good points, but I\'m having trouble seeing the connection to the article.",1425572449,4,California,David,api.nytimes.com/svc/community/v2/comments/user/id/331287.xml,1,14322906,0,0.003639268,0.025402881,0.066666667,10.1,15,1.386294361,36.701463,-118.755997,0.02116836,14.98632539,37.75806452,8.619915849,0.028751753,71.314195106,approved,Just be careful what you wish for. Techies ruined Austin.,1425572452,1,Manhattan,Vin,api.nytimes.com/svc/community/v2/comments/user/id/14195106.xml,1,14322921,0,0.040403796,0.078196101,0,10.1,10,0,40.790278,-73.959722,0.022818637,21.91967681,88.44106464,18.87072243,0.057984791,11.95454545331287,approved,"This is an important point, but just one factor in SV\'s early growth.",1425572469,5,California,David,api.nytimes.com/svc/community/v2/comments/user/id/331287.xml,1,14322953,0,0.015596691,0.037853911,0,10.1,14,1.609437912,36.701463,-118.755997,0.02116836,14.98632539,37.75806452,8.619915849,0.028751753,71.3331287,approved,"The problem is that people don\'t want what Cleveland produces; they want what SV produces, even if Cleveland has the RnR Hall of Fame.",1425572476,4,California,David,api.nytimes.com/svc/community/v2/comments/user/id/331287.xml,1,14323016,0,0.013662297,0.038525764,0,14.1,25,1.386294361,36.701463,-118.755997,0.02116836,14.98632539,37.75806452,8.619915849,0.028751753,71.3331287,approved,"Non-compete agreements are illegal in CA, not just unenforceable.",1425572479,5,California,David,api.nytimes.com/svc/community/v2/comments/user/id/331287.xml,1,14323031,0,0.010671096,0.053195824,0,10.1,10,1.609437912,36.701463,-118.755997,0.02116836,14.98632539,37.75806452,8.619915849,0.028751753,71.338234417,approved,"I\'m a lifer high tech guy with now just shy of 30 yrs in the Front Range (Boulder environs).  I went to a conference once in Orlando, and all I can say is that I had to cross it off my list of tech hub places I might conceive of living...yuck.  Just a huge flat strip mall with jillions of toll roads to get you somewhere, it appeared to me...but I did at least enjoy driving down to Canaveral one day.  The Front Range is very hard to beat, all things considered IMHO.  I would stress here that high tech R&amp;D intensive people really want to actually live where they want to live; drives the hardcore aerospace co HR folks nuts, but it\'s true.  Try to push them somewhere else, and they just quit and start a company.",1425572632,7,Denver,cph,api.nytimes.com/svc/community/v2/comments/user/id/38234417.xml,1,14323090,0,0.298157901,0.217475564,0.0625,27.5,144,1.945910149,39.739154,-104.984703,0.0373204,20.75384615,80.06730769,26.70192308,0.038461538,1.22352941251581368,approved,John:<br/><br/>Thanks for pointing out the obvious. I wondered when someone would mention the elephant in the room. ,1425572656,6,"San Francisco, CA",Joe Aaron,api.nytimes.com/svc/community/v2/comments/user/id/51581368.xml,1,14323110,0,0.00714179,0.011983629,0.05,10.1,18,1.791759469,37.779277,-122.41927,0.057225811,16.416,55,3.42,0.04,1.08695652266015063,approved,Comcast is a technology disaster. They are just the opposite of high tech. Philadelphia is better known for its bio tech companies.,1425572836,3,"Las Vegas,Nevada",NVFisherman,api.nytimes.com/svc/community/v2/comments/user/id/66015063.xml,1,14323119,0,0.237973803,0.202004708,0,12.9,22,1.098612289,36.166286,-115.149225,0.024497514,17.05821114,50.67888563,5.485337243,0.017595308,20.0588235369316274,approved,"As someone who went to public high school in Orlando and then fled north for college, I think that one of the reasons Silicon Valley is in Silicon Valley is that, until the Republicans gutted their property tax, California valued quality, higher education for all. California created the environment conducive for Silicon Valley.<br/><br/>And as someone who just returned from Carmel, California via San Jose,  I can attest to the fact that you can\'t beat vibrant climate of beautiful scenery, incredible food and engaged people looking for solutions for a better world.",1425572888,28,"Westport, CT",LK,api.nytimes.com/svc/community/v2/comments/user/id/69316274.xml,1,14323172,0,0.355929865,0.474021039,0.021052632,21.5,93,3.33220451,41.141486,-73.357896,0.03554346,25.75588235,115.7941176,27.20588235,0.029411765,3.466015063,approved,If your child is gifted why wouldn\'t you send them to a good private school. This applies to any city in the country.  I would rather my child be put in a challenging environment if I can afford it.,1425573607,1,"Las Vegas,Nevada",NVFisherman,api.nytimes.com/svc/community/v2/comments/user/id/66015063.xml,1,14323285,0,0.016177071,0.06925692,0.075,11.6,40,0,36.166286,-115.149225,0.024497514,17.05821114,50.67888563,5.485337243,0.017595308,20.0588235317906125,approved,"If you run and bike, none of the other cities in this article has the combination of mild weather and varying terrain that Silicon Valley offers. From my office, I can run the flat trails of the Baylands past the offices of Microsoft, Linkedin, and Google. Close by are the Santa Cruz mountains which challenge you with trail runs, fire roads for mountain bikes, or scenic roads among the redwoods that lead to the coast. The Pacific Ocean is close by for surfing and other water activities. My only beef is the length of the drive to the Sierras for skiing since I was spoiled with a short trip to the ski resorts when I lived in Salt Lake City. Many in the tech sector love this area because it\'s a great outdoor playground that\'s a place to recharge away from the office.",1425573490,16,California,Charles,api.nytimes.com/svc/community/v2/comments/user/id/17906125.xml,1,14323304,0,0.12812122,0.174382508,0.034482759,31.9,145,2.772588722,36.701463,-118.755997,0.046630891,16.825,58.83333333,4.333333333,0,0.1578947372242464,approved,Data is usually considered a singular noun in English despite its origin as the plural form of datum in Latin.,1425575117,3,"San Carlos, CA",GPS,api.nytimes.com/svc/community/v2/comments/user/id/2242464.xml,1,14323373,0,0.010211892,0.02573994,0,12.9,20,1.098612289,37.498206,-122.26615,0.021247499,20.48630952,80.30357143,5.273809524,0.017857143,2.7540983611941261,approved,"Every few years Johns Hopkins and other local educational, business and political concerns announce with the greatest fanfare a new \""tech\"" initiative for Baltimore.  All these launches share one thing in common - they flop.  Why?  Certainly for several reasons, but it\'s my estimation that tech types have little interest in living here.  Half the city is a ghetto, taxes are huge, crime is high, infrastructure is a disaster, the so-called \""subway\"" goes from nowhere to nowhere, the winter is worse than you\'d ever think, and the summer transforms the city into a fetid swamp.  I am here because I am locked into a job, but I spend as much time as I can out of town.  As a 20-something, I\'d say: no way!",1425575128,14,"Baltimore, MD",Tom,api.nytimes.com/svc/community/v2/comments/user/id/1941261.xml,1,14323411,0,0.121362537,0.123602958,0.046875,29.7,128,2.63905733,39.290861,-76.610807,0.017258989,21.426,78.44,36.36,0.04,0.80645161368595930,approved,Orlando has changed since you left 30 years ago.  It\'s become Portlandia in many areas.  I thought tech people were aware of the fact that things change?,1425575132,1,Miami,Feta,api.nytimes.com/svc/community/v2/comments/user/id/68595930.xml,1,14323512,0,0.398677936,0.292706439,0.035714286,11.6,28,0,25.774266,-80.193659,0.036225881,11.86,24.8,1.6,0,0.38461538510919504,approved,"There were a lot of initial reasons SV initially exploded (including a unique mix of Military-Industry Complex funding and counterculture lifestyles) but at this point it\'s basically a \""positive feedback loop\"" (same as with Hollywood and Wall Street) which sort of makes all these articles irrelevant.",1425574628,10,Illyria,Scott,api.nytimes.com/svc/community/v2/comments/user/id/10919504.xml,1,14323558,0,0.027666987,0.065443015,0,18.2,48,2.302585093,42.898593,-91.635152,0.011236951,23.00740741,96.05820106,4.989417989,0.015873016,2.4230769236835895,approved,"Indeed, I believe one of the many features of the Silicon Valley is that folks other than American heterosexual Caucasions feel comfortable residing here. Visit any one of the very many strip mall sandwich shops at lunch time and notice the large density and variety of non-Caucasions.",1425574688,9,"San Mateo, Ca",Howard,api.nytimes.com/svc/community/v2/comments/user/id/6835895.xml,1,14323573,0,0.120502314,0.245916869,0.020833333,17.2,48,2.197224577,37.496904,-122.333057,0.025633376,16.08461538,40.11538462,11,0,0.4062510919504,approved,"A powerful incumbent in an \""old school\"" industry is a drawback, not an advantage.",1425575148,1,Illyria,Scott,api.nytimes.com/svc/community/v2/comments/user/id/10919504.xml,1,14323588,0,0.026793225,0.038521418,0,10.1,14,0,42.898593,-91.635152,0.011236951,23.00740741,96.05820106,4.989417989,0.015873016,2.42307692314951172,approved,"In terms of quality of life, Seattle has all that Silicon Valley has and more. Three magnificent national parks lie on its doorstep: Olympic National Park, North Cascades National Park, and Mount Rainier National Park. The San Juans are a ferry ride away. The food, the air, the climate (no, it doesn\'t rain all the time), and the scenery are superb. The roads are less congested than they are in Silicon Valley, and housing is much cheaper. <br/><br/>What Seattle doesn\'t have is Stanford. UW is a respectable school, and it\'s improving, but it\'s not in Stanford or MIT\'s league. If you want to think about the difference a great school can make to a region\'s economy, imagine what Boston, with its ghastly climate and cramped layout, would be like without Harvard and MIT. Conservative politicians increasingly love to attack education in this country, especially public education. We\'ll see who has the last laugh.",1425575171,31,"port angeles, wa",Kaleberg,api.nytimes.com/svc/community/v2/comments/user/id/14951172.xml,1,14323622,0,0.122193637,0.245971732,0.00617284,30.8,160,3.433987204,48.118146,-123.430741,0.019405193,18.93928571,67.37755102,15.13265306,0.015306122,6.53333333340373428,approved,"A fundamental difference between the Silicon Valley and these promising areas in other states is the difference between California law and the laws of these others states regarding noncompetition agreements.  California law prohibits noncompetition agreements unless they fall within very narrow exceptions. The two main exceptions are when someone is selling a business or all of their interest in a business (as long as that interest is material and not just a small number of shares, for example). Florida and most other states allow employers to force employees to agree that they won\'t engage in a competing business for up to two years after they leave the employment.  <br/><br/>In the Silicon Valley, as long as an employee is not using the trade secrets of a former employer, the employee can work for a competing company whenever they want. California courts protect this right and scrutinize claims about needing to protect trade secrets of the former employer.  These laws were in effect when the founders of the first \""Silicon Valley\"" companies left their employers and started Intel, etc.  So far, it seems to be working well.<br/><br/>Even if you wanted to live in Orlando, Boise or Provo, if you consider yourself a true innovator and possible serial entrepreneur, unreasonable noncompetition agreements can kill your dreams.",1425574988,15,"San Rafael, California",Tom,api.nytimes.com/svc/community/v2/comments/user/id/40373428.xml,1,14323633,0,0.245758191,0.370893822,0,38.8,215,2.708050201,37.973535,-122.531087,0.027777778,25.85,116.5,12,0,0.05405405465260364,approved,"That\'s \""Hollywood Dreaming\""...  LA is nowhere near.  Not even close.",1425578022,1,New York,Andre,api.nytimes.com/svc/community/v2/comments/user/id/65260364.xml,1,14323806,0,0.018658733,0.061566638,0,8.3,11,0,40.730599,-73.986581,0.015256348,15.9082153,47.03824363,2.94723796,0.008144476,72.4102564123129280,approved,"    Columbus, in Ohio, is very progressive and tolerant, as is Cleveland.  In Columbus, we have a large LGBT community, our city leaders are people of color who run the city very well financially and otherwise.  It\'s a metro area of two million with over 100,000 college students.  We welcome people from everywhere.  Cleveland, Detroit, Chicago, Pittsburgh and other places that aren\'t in New York are the same.  \""Fly over country\"" is not some red monolith filled with uneducated hillbillies, as many on the coasts seem to think.",1425576489,12,Columbus,Roger,api.nytimes.com/svc/community/v2/comments/user/id/23129280.xml,1,14323955,0,0.070324496,0.089547961,0.033333333,22.2,90,2.48490665,39.96226,-83.000706,0.028864508,24.99577465,116.8028169,17.73943662,0.021126761,1.82051282151419510,approved,"Data can also be used as a collective noun, since  statistical discussion with N=1, a datum, are pointless.  If you are discussion a geographical location, a datum is fine.",1425578140,3,Madison VA,Bill R,api.nytimes.com/svc/community/v2/comments/user/id/51419510.xml,1,14323971,0,0.034335144,0.04273506,0,14.1,30,1.098612289,38.380406,-78.257504,0.023969847,19.03530499,60.59519409,4.537892791,0.033271719,8.45312518398873,approved,"Austin is the most likely candidate due to educational infrastructure, relatively low cost of living and quality of life (except for the opressive heat and opressive politics of course).",1425577029,4,Colorado,Cedar,api.nytimes.com/svc/community/v2/comments/user/id/18398873.xml,1,14324055,0,0.006932365,0.094231807,0,12.9,29,1.386294361,38.725178,-105.607717,0.025217603,25.11259259,117.3308642,24.85679012,0.059259259,6.32812524878,approved,"Still, Silicon Valley resident tech workers have faced -- and no doubt still do -- attempts to limit their mobility.  See this recent settlement on so-called \""non-poaching\"" agreements that tech owners set up and ran as long as they possibly could ...<br/><br/><a href=\""http://finance.yahoo.com/news/judge-oks-415m-settlement-tech-190945259.html\"" title=\""http://finance.yahoo.com/news/judge-oks-415m-settlement-tech-190945259.html\"" target=\""_blank\"">http://finance.yahoo.com/news/judge-oks-415m-settlement-tech-190945259.html</a>",1425578145,2,"San Francisco, CA",Berkeley Bee,api.nytimes.com/svc/community/v2/comments/user/id/24878.xml,1,14324091,0,0.301370731,0.375136481,0,20.7,42,0.693147181,37.779277,-122.41927,0.030019482,20.40391499,83.6655481,6.414988814,0.013422819,19.4347826125345298,approved,"Boulder is a nice place, but so space constrained that if your business takes off, you will be hard pressed to stay in that location.   And if you move, why a hop to, say Denver, but why not into the highly attractive brain vortex of Silicon Valley? <br/><br/>The biggest problem many sites have is simply no ability to scale.  Your rapidly growing business can attract 100 more top tier workers in Silicon Valley and maybe somewhere like NY, but Orlando?  Really?  Since no one starts a business with the intent to fail, the net result of the lack of a deep workforce is a real drawback on top of all the other drawbacks pointed out in the article. ",1425578044,6,NY,MH,api.nytimes.com/svc/community/v2/comments/user/id/25345298.xml,1,14324113,0,0.303783507,0.35890773,0,25,118,1.791759469,43.156168,-75.844995,0.008756814,27.00573477,122.1684588,5.666666667,0.021505376,4.22727272754281250,approved,What he means is that the tech people want to be around other rich tech people and don\'t want to be around blue collar Pittsburgh folks.<br/><br/>Let \'em leave to their godawful expensive region that will only get more expensive as the water continues to dry up.  Long live the \'burgh.,1425578051,4,Houston,J,api.nytimes.com/svc/community/v2/comments/user/id/54281250.xml,1,14324116,0,0.20380404,0.185053888,0,14.1,52,1.386294361,29.981501,-95.53836,0.019073878,17.16914498,59.83643123,8.661710037,0.026022305,3.95588235320516025,approved,"From my perspective, as a form math professor, this excellent article misses only one important point about the conflict between traditional colleges and online courses â€“ a point that my experience teaching from an online MIT course at Washington U. in St. Louis, makes clear.  <br/><br/>Many traditional colleges, seeing students as â€œcustomersâ€ù, teach only what those customers â€œthink they need to knowâ€ù, not what â€œthey need to knowâ€ù. <br/><br/>Online courses can expose this strategy.<br/><br/>For example, when I taught a math course that is a critical requirement for engineers, I utilized the available MIT online materials.  Those materials were excellent, but challenging.  My chair and the administrators from the Engineering school were upset. <br/><br/>My Chair told me that he wasnâ€™t going to let the Engineering School take away (the apparently highly lucrative) course and he demanded that I teach the normal â€œcookbookâ€ù course so that he wouldn\'t have \""trouble\"".<br/><br/>When I wrote the Dean of Eng. Student Academic Integrity that the students who cheated on the homework were the ones who did poorly on the test, he replied that I shouldnâ€™t â€œdiscourageâ€ù students and that â€œretentionâ€ù was critical.<br/><br/>On the web, one can access both the course I taught (or just the MIT course) and the â€œcookbookâ€ù course that Wash. U., and many other schools, teach. If people do that, I believe that two things will happen: the value of online courses will be apparent; and, some so-called â€œeliteâ€ù schools will have to clean up their act.",1425578089,0,"Kirkwood, Mo",Mark  Feldman,api.nytimes.com/svc/community/v2/comments/user/id/20516025.xml,1,14324202,0,0.009981532,0.039424281,0.045977011,37.5,249,0,38.5777,-90.418655,0.02993627,35.025,205.435,7.825,0.01,8.69565217464671572,approved,"a lot of the politics are killers (i.e., anti-abortion, anti-homosexual, etc.). ",1425583453,5,DC,Yoda,api.nytimes.com/svc/community/v2/comments/user/id/64671572.xml,1,14324256,0,0.007587053,0.014597987,0.071428571,11.6,14,1.609437912,38.893715,-76.987793,0.014769709,14.79690821,37.54202899,5.192753623,0.008695652,48.1395348866707515,approved,"Orlando? The extremely humid, dull city in central Florida not near any beaches? That city is the last place any up-and-coming tech company would want to be. I\'ll stick with NY or CA, which are both conveniently located far away from the South.",1425583460,20,a,nothingreally,api.nytimes.com/svc/community/v2/comments/user/id/66707515.xml,1,14324262,0,0.311673704,0.287316617,0.02173913,11.6,46,2.995732274,40.769627,44.673665,0.028216857,22.15,92.16666667,21.33333333,0.166666667,0.20689655265260364,approved,Plenty of places HSR natural beauty (even Idaho is beautiful) and many people like seasons...  The Bay Areas success had to do with the universities and te defense contractors and the cheap land in that area of the Valley. Like other places - once the industry starts rolling - it just keeps going.,1425583485,0,New York,Andre,api.nytimes.com/svc/community/v2/comments/user/id/65260364.xml,1,14324275,0,0.080663039,0.162893606,0,18.2,51,0,40.730599,-73.986581,0.015256348,15.9082153,47.03824363,2.94723796,0.008144476,72.4102564164671572,approved,"very well put. If anything, non-compete agreements had prevented Boston from being the next silicon valley. The most important factor by far. ",1425583489,3,DC,Yoda,api.nytimes.com/svc/community/v2/comments/user/id/64671572.xml,1,14324276,0,0.198454371,0.413868179,0,12.9,23,1.098612289,38.893715,-76.987793,0.014769709,14.79690821,37.54202899,5.192753623,0.008695652,48.13953488